8703945	Download a file from a site (partly written in Javascript) using Python	javascript|python|selenium|download	2012-01-02 18:12:46.143000 UTC	"<p>I'm trying to use Python to download a voice file (mp3) from <a href=""http://ivona.com/pl/"" rel=""nofollow noreferrer"">this</a> site:</p>  <p>I've tried to use mechanize and twill but I haven't got the proper result. I've heard about selenium as well. Anyway, I don't even know if it makes sense technically (mechanize + Javascript).</p>  <p>I was looking for an answer and finally I've found this <a href=""https://stackoverflow.com/a/8289068/1126604"">solution</a>.</p>  <p>It seems like a similar problem to mine but I have absoutely no idea what should I put instead of the 4th line.</p>  <p>If you have any proposition (maybe completely different to mine) I'll be glad to see it.</p>"	8704187	"<p><em>(Moving to answer to get more space)</em></p>  <p>Thanks for pointing me to selenium, I didn't know that and it looks cool; anyways: I had a quick look and the js seems to fire an ajax request, that yields no apparent result -- I guess the audio transfer is done some way in the background via flash or so; anyways: what about using the service they offer: developer.ivona.com instead of trying hacking your webservice out of the demo interface..?</p>  <p>Anyways, here it is the hacked web-service you asked for:</p>  <p>This is the URL you want to GET:</p>  <pre><code>""http://www.ivona.com/voicetest.php?rtr=1&amp;t2r=%(the_text)s..&amp;v2r=dXNfc2FsbGk.&amp;lang=us"" % dict(     the_text=base64.b64encode(""Hello, world!""),     the_voice=base64.b64encode(""us_salli""),     ) </code></pre>  <p>You can test that with, for example, mplayer:</p>  <pre><code>mplayer ""http://www.ivona.com/voicetest.php?rtr=1&amp;t2r=SGVsbG8sIHdvcmxkIQ==..&amp;v2r=dXNfc2FsbGk.&amp;lang=us"" </code></pre>  <p>And, from Python, use urllib to retrieve and store somewhere.</p>  <p>Beware that, since this is an unauthorized use, you might get blocked / incur in legal issues / etc. -- don't use in a production application!</p>"
8725401	Difference between Python and Javascript in evaluating a regular expression	javascript|python|regex	2012-01-04 10:36:25.583000 UTC	"<p>First of all, this is not a dupe of <a href=""https://stackoverflow.com/questions/636485/whats-different-between-python-and-javascript-regular-expressions"">this question</a>.</p>  <p>In Javascript this expression seems to be evaluated correctly:</p>  <pre><code>\\/(omniture|mbox|hbx|omniunih)(.*)? </code></pre>  <p>If I pass it to Python <code>re</code> module, bad things happen. In fact, the following returns an error:</p>  <pre><code>import re re.compile (u'\\/(omniture|mbox|hbx|omniunih)(.*)?')  In [101]: re.compile (u'\\/(omniture|mbox|hbx|omniunih)(.*)?') --------------------------------------------------------------------------- error                                     Traceback (most recent call last) /home/fakk/spider.io/1/&lt;ipython-input-101-b5b19eb3b66e&gt; in &lt;module&gt;() ----&gt; 1 re.compile (u'\\/(omniture|mbox|hbx|omniunih)(.*)?')  /usr/lib/python2.7/re.pyc in compile(pattern, flags)     188 def compile(pattern, flags=0):     189     ""Compile a regular expression pattern, returning a pattern object."" --&gt; 190     return _compile(pattern, flags)     191      192 def purge():  /usr/lib/python2.7/re.pyc in _compile(*key)     242         p = sre_compile.compile(pattern, flags)     243     except error, v: --&gt; 244         raise error, v # invalid expression     245     if len(_cache) &gt;= _MAXCACHE:     246         _cache.clear()  error: nothing to repeat </code></pre>  <p>Python complains about the <code>(.*)?</code> part, which me myself am not able to understand.</p>  <p>My questions are:</p>  <ol> <li>What does <code>(.*)?</code> do in JS? Match zero or one (<code>?</code>) of zero or more (<code>*</code>) chars (<code>.</code>)? What's the point?</li> <li>How can I translate it in Python?</li> </ol>"	8725512	"<p>The question mark is superfluous, as you reflect yourself, it doesn't really make any sense, remove it and you should be in business.</p>"
8725401	Difference between Python and Javascript in evaluating a regular expression	javascript|python|regex	2012-01-04 10:36:25.583000 UTC	"<p>First of all, this is not a dupe of <a href=""https://stackoverflow.com/questions/636485/whats-different-between-python-and-javascript-regular-expressions"">this question</a>.</p>  <p>In Javascript this expression seems to be evaluated correctly:</p>  <pre><code>\\/(omniture|mbox|hbx|omniunih)(.*)? </code></pre>  <p>If I pass it to Python <code>re</code> module, bad things happen. In fact, the following returns an error:</p>  <pre><code>import re re.compile (u'\\/(omniture|mbox|hbx|omniunih)(.*)?')  In [101]: re.compile (u'\\/(omniture|mbox|hbx|omniunih)(.*)?') --------------------------------------------------------------------------- error                                     Traceback (most recent call last) /home/fakk/spider.io/1/&lt;ipython-input-101-b5b19eb3b66e&gt; in &lt;module&gt;() ----&gt; 1 re.compile (u'\\/(omniture|mbox|hbx|omniunih)(.*)?')  /usr/lib/python2.7/re.pyc in compile(pattern, flags)     188 def compile(pattern, flags=0):     189     ""Compile a regular expression pattern, returning a pattern object."" --&gt; 190     return _compile(pattern, flags)     191      192 def purge():  /usr/lib/python2.7/re.pyc in _compile(*key)     242         p = sre_compile.compile(pattern, flags)     243     except error, v: --&gt; 244         raise error, v # invalid expression     245     if len(_cache) &gt;= _MAXCACHE:     246         _cache.clear()  error: nothing to repeat </code></pre>  <p>Python complains about the <code>(.*)?</code> part, which me myself am not able to understand.</p>  <p>My questions are:</p>  <ol> <li>What does <code>(.*)?</code> do in JS? Match zero or one (<code>?</code>) of zero or more (<code>*</code>) chars (<code>.</code>)? What's the point?</li> <li>How can I translate it in Python?</li> </ol>"	8725560	"<p>Your regular expression does not make sense, the <code>?</code> at the end of your string is not needed and will in fact never match anything. In addition I suggest you use <code>r''</code> to make your expression easier to read:</p>  <pre><code>import re my_regex = re.compile(r'\/(omniture|mbox|hbx|omniunih)(.*)') </code></pre>"
8838334	How can I debug txJSON-Rpc calls using a javascript client and Python server?	python|rpc|json-rpc	2012-01-12 16:13:54.087000 UTC	"<p>I have implemented a wxPython app, that also has a Twisted txJSONrpc server in it. This is my RPC ""server""; I can call it using a TCP socket and issue commands.  </p>  <p>There is a Python test script called client_subhandled.py in txjsonrpc that I used to test, and it calls and receives an answer from the RPC server, so Python client/server communication works.  </p>  <p>However, I need to make JSON RPC calls from javascript, not from Python. To do that I have used a small java applet that allows you to open a TCP socket from javascript and read and write to/from it (java_socket_bridge.js). This also works, I have tested it not using the JSON RPC protocol, but sending and receiving plain text using a simple twisted echo protocol.</p>  <p>The problem is that using javascript as a client, I can't seem to get rpc JSON calls to work. Is there a way to debug incoming JSON rpc calls in txJSONrpc? I would ideally like to see what JSON objects come in in the server to see if they're compliant.  </p>  <p>Thanks!</p>  <pre><code>from twisted.internet import wxreactor  # socket library wxreactor.install()                     # for using twisted along with wxPython  # using netstring TCP protocol from txjsonrpc.netstring import jsonrpc from twisted.web import server  # import twisted reactor *only after* installing wxreactor from twisted.internet import reactor  myreactor = reactor  def register(application):     # initialise and run the TWISTED reactor     reactor.registerWxApp(application)     #rpcCom.myreactor.listenTCP(9000, rpcCom.EchoServerFactory())     reactor.listenTCP(9000, factory)     reactor.run()  class Example(jsonrpc.JSONRPC):     """"""An example object to be published.""""""      def jsonrpc_echo(self, x):         """"""Return all passed args.""""""         print ""echo called""         return x  class Testing(jsonrpc.JSONRPC):      def jsonrpc_getList(self):         """"""Return a list.""""""         return [1,2,3,4,'a','b','c','d']  class Math(jsonrpc.JSONRPC):     """"""     An example object to be published.     """"""     def jsonrpc_add(self, a, b):         """"""         Return sum of arguments.         """"""         return a + b  factory = jsonrpc.RPCFactory(Example) factory.putSubHandler('math', Math) factory.putSubHandler('testing', Testing)  factory.addIntrospection() </code></pre>"	8852161	"<p>have you tried using <a href=""http://www.wireshark.org"" rel=""nofollow"">Wireshark</a> ?</p>  <p>Be careful, it seems like there are some issues when capturing on localhost ;)</p>"
8898961	Python BeautifulSoup on javascript tables with multiple pages	javascript|python|screen-scraping|beautifulsoup	2012-01-17 17:23:55.010000 UTC	"<p>I used to have a python script that pulled data from the below table properly using Mechanize and BeautifulSoup.  However, this site has recently changed the encoding of the table to javascript, and I'm having trouble working with it because there are multiple pages to the table.</p>  <p><a href=""http://www.fangraphs.com/leaders.aspx?pos=all&amp;stats=bat&amp;lg=all&amp;qual=0&amp;type=8&amp;season=2011&amp;month=0&amp;season1=&amp;ind=0&amp;team=25&amp;players=0"" rel=""nofollow"">http://www.fangraphs.com/leaders.aspx?pos=all&amp;stats=bat&amp;lg=all&amp;qual=0&amp;type=8&amp;season=2011&amp;month=0&amp;season1=&amp;ind=0&amp;team=25&amp;players=0</a></p>  <p>For example, in the link above, how could I grab the data from both page 1 and page 2 of the table? FWIW, The URL doesn't change.</p>"	8899034	"<p>Mechanize doesn't handle javascript.</p>  <p>You could observe what requests are made when you click the button (using Firebug in Firefox or Developer Tools in Chrome). Than try to reverse engineer the javascript running behind the page and try to do the similar thing using your python code, for that take a look at <a href=""http://code.google.com/p/python-spidermonkey/"" rel=""nofollow"">Spidermonkey</a> or</p>  <p>Try using <code>Selenium</code>.</p>  <blockquote>   <p>Selenium is a funcitonal testing framework which automates the browser to perform certain operations which in turn test the underlying actions of your code</p> </blockquote>"
8898961	Python BeautifulSoup on javascript tables with multiple pages	javascript|python|screen-scraping|beautifulsoup	2012-01-17 17:23:55.010000 UTC	"<p>I used to have a python script that pulled data from the below table properly using Mechanize and BeautifulSoup.  However, this site has recently changed the encoding of the table to javascript, and I'm having trouble working with it because there are multiple pages to the table.</p>  <p><a href=""http://www.fangraphs.com/leaders.aspx?pos=all&amp;stats=bat&amp;lg=all&amp;qual=0&amp;type=8&amp;season=2011&amp;month=0&amp;season1=&amp;ind=0&amp;team=25&amp;players=0"" rel=""nofollow"">http://www.fangraphs.com/leaders.aspx?pos=all&amp;stats=bat&amp;lg=all&amp;qual=0&amp;type=8&amp;season=2011&amp;month=0&amp;season1=&amp;ind=0&amp;team=25&amp;players=0</a></p>  <p>For example, in the link above, how could I grab the data from both page 1 and page 2 of the table? FWIW, The URL doesn't change.</p>"	8899172	"<p>Your best bet is to run a headless browser e.g <a href=""http://www.phantomjs.org/"" rel=""nofollow"">phantomjs</a> which understands all the intricacies of JavaScript, DOM etc but you will have to write your code in Javascript, benefit is that you can do whatever you want, parsing html using BeautifulSoup is cool for a while but is headache in long term. So why scrape when you can access the DOM</p>"
8922206	Python - clicking a javascript button	javascript|python|html|post	2012-01-19 07:02:15.180000 UTC	"<p>I have a button on a page that needs to be clicked for me to move on to the next page in a sequence, and I was wondering how this is possible with Python. The button seems to be the mix of an HTTP POST request and Javascript, here is the code for the button:</p>  <pre><code>&lt;FORM name=""ff"" action=""nq2.phtml"" method=""post""&gt;   &lt;INPUT type=""hidden"" name=""target"" value=""-1""&gt;   &lt;INPUT type=""hidden"" name=""fact"" value=""""&gt;   &lt;INPUT type=""hidden"" name=""parm"" value=""""&gt;   &lt;INPUT type=""hidden"" name=""use_id"" value=""-1""&gt;   &lt;INPUT type=""hidden"" name=""nxactor"" value=""1""&gt;   &lt;TD align=""center"" valign=""top""&gt;   &lt;DIV class=""pr""&gt;   &lt;A href=""javascript:;"" onClick=""settarget(5); setch(ch5); return false;""&gt; </code></pre>  <p>I honestly have no idea how to approach something like this and was wondering if anyone had some insight about how I would go about doing it.</p>"	8922376	"<p>To simulate the submission of a form, you can send the same POST request that your browser will send to the site once the submit button is clicked. One way to do this is use <code>urllib.urlencode</code> to encode the form data from a dictionary and <code>urllib2.urlopen</code> to send the request:</p>  <pre><code>import urllib, urllib2 form_data = urllib.urlencode({'target': &lt;value&gt;, 'fact': &lt;value&gt;, ...}) urllib2.urlopen(""np2.phtml"", form_data) </code></pre>"
8928785	Options to parse a JavaScript web app in Python	javascript|python	2012-01-19 15:33:36.857000 UTC	"<p>Have to write a Python app to communicate and fetch some data from a password protected, JavaScript enabled web app.</p>  <p>The webapp unfortunately requires JavaScript to run, and refuses to work if JavaScript is disabled.  Therefore, 'urllib2' and 'requests' don't work when trying to fetch data.</p>  <p>What are my options at this point?  If I grabbed HTTP traffic via some tool such as Firebug, and tried re-playing this traffic via some Python method, would this work?  All I need for the script to do is:</p>  <ol> <li>Login into website</li> <li>Change a dropdown item</li> <li>Grab a single line of text and logout</li> </ol>"	8929166	"<p>Your best bet is to run a headless browser like <a href=""http://pypi.python.org/pypi/PyPhantomJS"" rel=""nofollow"">PyPhantomJS</a> which understands javascript. You have to write your code in javascript and than you can do whatever you want.</p>  <blockquote>   <p>It has fast and native support for DOM handling, CSS selector and of course JavaScript.</p> </blockquote>"
8937190	Trigger Javascript event on remote website with Python	javascript|python|dom|web-scraping	2012-01-20 05:38:33.210000 UTC	"<p>I wrote some basic Python code to scrape a remote webpage and grab a few pieces of data. On a different page I'm trying to scrape, the data is hidden from view, and only appears after changing the value of a <code>&lt;select&gt;</code> box. </p>  <p>After de-minifying and digging through the remote website's javascript, I confirmed that it is using AJAX (custom implementation of Prototype I think) to switch the <code>&lt;tbody&gt;</code> of the <code>&lt;table&gt;</code> I'm interested in scraping.</p>  <p>Is there a way to use Python (or Javascript via Python) to trigger the onChange event of that select box so I can ""refresh"" the DOM and grab the new HTML?</p>"	8943959	<p>Figure out the AJAX request URL and request it directly.  :-)</p>
8960288	Get page generated with Javascript in Python	javascript|python|html|download|urllib2	2012-01-22 09:59:23.947000 UTC	<p>I'd like to download web page generated by <code>Javascript</code> and store it to string variable in <code>Python</code> code. The page is generated when you click on button.</p>  <p>If I would know the resulting URL I would use <code>urllib2</code> but this is not the case.</p>  <p>thank you</p>	8960386	"<p>You could use <a href=""http://seleniumhq.org/docs/03_webdriver.html"" rel=""noreferrer"">Selenium Webdriver</a>:</p>  <pre><code>#!/usr/bin/env python from contextlib import closing from selenium.webdriver import Firefox # pip install selenium from selenium.webdriver.support.ui import WebDriverWait  # use firefox to get page with javascript generated content with closing(Firefox()) as browser:      browser.get(url)      button = browser.find_element_by_name('button')      button.click()      # wait for the page to load      WebDriverWait(browser, timeout=10).until(          lambda x: x.find_element_by_id('someId_that_must_be_on_new_page'))      # store it to string variable      page_source = browser.page_source print(page_source) </code></pre>"
9013400	"Use python to a open web browser (on windows), trigger javascript actions, and get the html contents?"	javascript|python|windows	2012-01-26 02:47:53.487000 UTC	"<p>Yes that sounds overly complicated.</p>  <p>I am trying to mine data from pages on our intranet. The pages are secure. The connection is refused when I try to get the contents with urllib.urlopen().</p>  <p>So I would like to use python to open a web browser to open the site then click some links that trigger javascript pop ups containing tables of info that I want to collect.</p>  <p>Any suggestions on where to begin?</p>  <p>I know the format of the page. It is something like this:</p>  <pre><code>&lt;div id=""list""&gt;     &lt;ul id=""list item""&gt;         &lt;li&gt;&lt;a onclict=""Openpopup('1');""&gt;blah&lt;/a&gt;&lt;/li&gt;     &lt;/ul&gt;     &lt;ul&gt;&lt;/ul&gt;     etc </code></pre>  <p>Then a hidden frame becomes visible and the fields in the table within are filled.</p>  <pre><code>&lt;div&gt;     &lt;table&gt;        &lt;tr&gt;&lt;td&gt;&lt;span id=""info_i_want""&gt;... </code></pre>"	9013425	"<p>First off, I suggest that it's better to figure out what the page needs that JS is providing, and fake that - you'll have an easier time scraping the page if a browser isn't involved.</p>  <p>If it's <em>just</em> Javascript making an XMLHttpRequest, you can find the page from which the Javascript fetches the <code>iframe</code> data and connect directly to that.</p>  <p>But in spite of that you may need a library that does Javascript execution (if the reverse-engineering is too hard or it uses challenge tokens). A web-rendering framework like Gecko or WebKit might be appropriate.</p>  <p>Take a good look at <a href=""http://seleniumhq.org/"" rel=""noreferrer"">Selenium</a> if you insist on using a true web browser or cannot get the programmatic methods to work.</p>  <p>Once you've gotten the page contents via whatever method, you need an <em>HTML parser</em> (such as <code>sgmllib</code> or [almost] <code>xml.dom</code>). I suggest a DOM library. Parse the DOM and extract the contents from the appropriate node in the resulting tree.</p>"
9013400	"Use python to a open web browser (on windows), trigger javascript actions, and get the html contents?"	javascript|python|windows	2012-01-26 02:47:53.487000 UTC	"<p>Yes that sounds overly complicated.</p>  <p>I am trying to mine data from pages on our intranet. The pages are secure. The connection is refused when I try to get the contents with urllib.urlopen().</p>  <p>So I would like to use python to open a web browser to open the site then click some links that trigger javascript pop ups containing tables of info that I want to collect.</p>  <p>Any suggestions on where to begin?</p>  <p>I know the format of the page. It is something like this:</p>  <pre><code>&lt;div id=""list""&gt;     &lt;ul id=""list item""&gt;         &lt;li&gt;&lt;a onclict=""Openpopup('1');""&gt;blah&lt;/a&gt;&lt;/li&gt;     &lt;/ul&gt;     &lt;ul&gt;&lt;/ul&gt;     etc </code></pre>  <p>Then a hidden frame becomes visible and the fields in the table within are filled.</p>  <pre><code>&lt;div&gt;     &lt;table&gt;        &lt;tr&gt;&lt;td&gt;&lt;span id=""info_i_want""&gt;... </code></pre>"	9013429	"<p>First of all, you should really find out why the connection is refused when you access the page with Python. Most likely, you'll have to perform HTTP authentication or specify a different User-Agent.</p>  <p>Firing up a browser, navigating, and getting the HTML back is a complex task. Luckily, you can implement it using <a href=""http://code.google.com/p/selenium/wiki/PythonBindings"" rel=""nofollow"">selenium</a>.</p>"
9013400	"Use python to a open web browser (on windows), trigger javascript actions, and get the html contents?"	javascript|python|windows	2012-01-26 02:47:53.487000 UTC	"<p>Yes that sounds overly complicated.</p>  <p>I am trying to mine data from pages on our intranet. The pages are secure. The connection is refused when I try to get the contents with urllib.urlopen().</p>  <p>So I would like to use python to open a web browser to open the site then click some links that trigger javascript pop ups containing tables of info that I want to collect.</p>  <p>Any suggestions on where to begin?</p>  <p>I know the format of the page. It is something like this:</p>  <pre><code>&lt;div id=""list""&gt;     &lt;ul id=""list item""&gt;         &lt;li&gt;&lt;a onclict=""Openpopup('1');""&gt;blah&lt;/a&gt;&lt;/li&gt;     &lt;/ul&gt;     &lt;ul&gt;&lt;/ul&gt;     etc </code></pre>  <p>Then a hidden frame becomes visible and the fields in the table within are filled.</p>  <pre><code>&lt;div&gt;     &lt;table&gt;        &lt;tr&gt;&lt;td&gt;&lt;span id=""info_i_want""&gt;... </code></pre>"	9013508	"<p><code>The connection is refused when I try to get the contents with urllib.urlopen().</code> probably means you have to make a post request using python urllib module.I would suggest you use <a href=""http://docs.python.org/library/urllib2.html"" rel=""nofollow"">urllib2</a>.You may also need to handle <a href=""http://docs.python.org/library/cookielib.html"" rel=""nofollow"">cookies</a>, <code>referrer,user-agent</code> from your python code.</p>  <p>To see all the post request fired from your browser use firefox's <a href=""https://addons.mozilla.org/en-US/firefox/addon/live-http-headers/"" rel=""nofollow"">live-http-headers</a>.</p>  <p>For the javascript part,</p>  <p>Your best bet is to run a headless browser e.g <a href=""http://www.phantomjs.org/"" rel=""nofollow"">phantomjs</a> which understands all the intricacies of JavaScript, DOM etc but you will have to write your code in Javascript, benefit is that you can do whatever you want.</p>  <p>As, @phihag mentioned <code>selenium</code> is also a good option.</p>"
9013400	"Use python to a open web browser (on windows), trigger javascript actions, and get the html contents?"	javascript|python|windows	2012-01-26 02:47:53.487000 UTC	"<p>Yes that sounds overly complicated.</p>  <p>I am trying to mine data from pages on our intranet. The pages are secure. The connection is refused when I try to get the contents with urllib.urlopen().</p>  <p>So I would like to use python to open a web browser to open the site then click some links that trigger javascript pop ups containing tables of info that I want to collect.</p>  <p>Any suggestions on where to begin?</p>  <p>I know the format of the page. It is something like this:</p>  <pre><code>&lt;div id=""list""&gt;     &lt;ul id=""list item""&gt;         &lt;li&gt;&lt;a onclict=""Openpopup('1');""&gt;blah&lt;/a&gt;&lt;/li&gt;     &lt;/ul&gt;     &lt;ul&gt;&lt;/ul&gt;     etc </code></pre>  <p>Then a hidden frame becomes visible and the fields in the table within are filled.</p>  <pre><code>&lt;div&gt;     &lt;table&gt;        &lt;tr&gt;&lt;td&gt;&lt;span id=""info_i_want""&gt;... </code></pre>"	9028251	"<p>Consider taking a look at <a href=""http://splinter.cobrateam.info/"" rel=""nofollow"">splinter</a> which is a simpler webdriver API than Selenium.</p>"
9142911	How to fetch complete webpage (using javascript) in python	javascript|python|webpage	2012-02-04 17:41:05.460000 UTC	"<p>I'm trying to use urllib2 to fetch webpage from a website. After I managed to log on and retrieve the page, I found out the page has some <code>&lt;script&gt;.....&lt;/script&gt;</code> inside. How can I save the rendered the output (the complete content of the webpage, not the script)?</p>"	9143052	"<p>Javascript can't be easily handled if you are using urllib.</p>  <p>What you need is a headless browser, for ex. WebKit.</p>  <p>A simple example can be found <a href=""http://sitescraper.net/blog/Scraping-JavaScript-webpages-with-webkit/"" rel=""nofollow"">here.</a> </p>  <p>If you don't want yourself to be limited to python, try <a href=""http://www.phantomjs.org/"" rel=""nofollow"">Phantomjs</a></p>"
9142911	How to fetch complete webpage (using javascript) in python	javascript|python|webpage	2012-02-04 17:41:05.460000 UTC	"<p>I'm trying to use urllib2 to fetch webpage from a website. After I managed to log on and retrieve the page, I found out the page has some <code>&lt;script&gt;.....&lt;/script&gt;</code> inside. How can I save the rendered the output (the complete content of the webpage, not the script)?</p>"	9143296	"<p>I'd also like to mention <a href=""http://code.google.com/p/pywebkitgtk/"" rel=""nofollow"">pywebkitgtk</a> (which I've been using a lot lately as an embedded browser), and <a href=""http://pypi.python.org/pypi/selenium"" rel=""nofollow"">Selenium</a>.</p>"
