61587109	"regex catch inline math formula, ex: $ inline $ in python or javascript"	javascript|python|regex	2020-05-04 07:26:48.447000 UTC	"<p>I have a string input (a content of a markdown file), where every math formula enclosed by $$. </p>  <p>Ex:</p>  <pre><code>$$ stand alone $$  $$ stand  alone $$   And there $$ inline $$.   $$ inline 2 $$ some text also.  </code></pre>  <p>I would like to change the <em>inline</em> formulas to be enclosed by $. </p>  <p>I tried to catch with regex, but so far I can not come up with the right solution.</p>  <p>This one example catch every $$ but do not distinct inline and stand-alone:</p>  <pre class=""lang-py prettyprint-override""><code>re.findall(r'\$\$([^\$]+?)\$\$',  txt)  </code></pre>"	"<p>First, you can use <code>.*+</code> instead of <code>[^$]+</code>. It doesn't capture patterns which include <code>\n</code>.</p>  <p>Then, put ""not at starting of line-<code>(?!^)</code>"" and ""not at ending of line-<code>(?&lt;!$)</code>"". And use <code>|</code> to combine them.</p>  <pre class=""lang-py prettyprint-override""><code>print(re.findall(r'(?m)(?!^)\$\$(.+?)\$\$|\$\$(.+?)\$\$(?&lt;!$)', txt)) </code></pre>  <p>will print:</p>  <pre class=""lang-py prettyprint-override""><code>[(' inline ', ''), ('', ' inline 2 ')] </code></pre>  <p><code>(?m)</code> indicates ""multiline"" flag.</p>  <p>If you want to replace those to <code>REPLACED!!</code>,</p>  <pre class=""lang-py prettyprint-override""><code>print(re.sub(r'(?m)(?!^)\$\$(.+?)\$\$|\$\$(.+?)\$\$(?&lt;!$)', '$$ REPLACED!! $$', text)) </code></pre>  <p>output:</p>  <pre><code>$$ stand alone $$  $$ stand  alone $$   And there $$ REPLACED!! $$.   $$ REPLACED!! $$ some text also. </code></pre>  <hr>  <p>If you dislike that group number is not consistent,</p>  <p>You can use conditional pattern:</p>  <pre class=""lang-py prettyprint-override""><code>print(re.findall(r'(?m)(.+)?\$\$(.+?)\$\$(?(1)|.+)', text)) </code></pre>  <p>output:</p>  <pre class=""lang-py prettyprint-override""><code>[('And there ', ' inline '), ('', ' inline 2 ')] </code></pre>  <p>Now the target group number is always 2.</p>"
61593886	How to click on a WebElement using JavaScript using RobotFramework SeleniumLibrary in Python?	javascript|python|selenium|robotframework	2020-05-04 13:51:50.967000 UTC	"<p>I'm trying to click on a WebElement using JavaScript but I'm unable to create a JavaScript statement for that. </p>  <p>I'm able to click on a <strong>Cancel</strong> button using this statement</p>  <pre><code>driver.execute_javascript(""$(\""div[title='Cancel']\"")[0].click()"") </code></pre>  <p>But on clicking another element which is more complicated, I'm trying this </p>  <pre><code>expand_xpath = ""//span[text()='Submit']//ancestor::table//a[text()='Expand']"" driver.execute_javascript(""document.getElementByXpath('${expand_xpath}').click()"") </code></pre>  <p><em>JavascriptException: Message: javascript error: document.getElementByXpath is not a function</em></p>  <p>This <strong>expand_xpath</strong> is storing xpath of the WebElement which I need to click but I'm unable to frame the JS code for clicking this element.</p>  <p>Please find the RobotFramework <strong>Execute Javascript</strong> keyword expnation on this link <a href=""https://robotframework.org/SeleniumLibrary/SeleniumLibrary.html#Execute%20Javascript"" rel=""nofollow noreferrer"">https://robotframework.org/SeleniumLibrary/SeleniumLibrary.html#Execute%20Javascript</a></p>  <p>Second Try:</p>  <pre><code>expand_xpath = ""//span[text()='Submit']//ancestor::table//a[text()='Expand']"" driver.execute_javascript(""document.evaluate('${expand_xpath}', document.body, null, 9, null).singleNodeValue.click()"") </code></pre>  <p>Output:</p>  <pre><code>JavascriptException: Message: javascript error: missing ) after argument list </code></pre>"	"<p>Since you're using RobotFramework, this one is quite easy:</p>  <pre><code>${locator}    //button[@id='abc'] Execute JavaScript    document.evaluate(""${locator}"", document, null, XPathResult.FIRST_ORDERED_NODE_TYPE, null).singleNodeValue.click() </code></pre>  <p>Note that the inputted xpath should not contain double quote ("") character, only single quote (') to prevent JS parsing error</p>"
61593886	How to click on a WebElement using JavaScript using RobotFramework SeleniumLibrary in Python?	javascript|python|selenium|robotframework	2020-05-04 13:51:50.967000 UTC	"<p>I'm trying to click on a WebElement using JavaScript but I'm unable to create a JavaScript statement for that. </p>  <p>I'm able to click on a <strong>Cancel</strong> button using this statement</p>  <pre><code>driver.execute_javascript(""$(\""div[title='Cancel']\"")[0].click()"") </code></pre>  <p>But on clicking another element which is more complicated, I'm trying this </p>  <pre><code>expand_xpath = ""//span[text()='Submit']//ancestor::table//a[text()='Expand']"" driver.execute_javascript(""document.getElementByXpath('${expand_xpath}').click()"") </code></pre>  <p><em>JavascriptException: Message: javascript error: document.getElementByXpath is not a function</em></p>  <p>This <strong>expand_xpath</strong> is storing xpath of the WebElement which I need to click but I'm unable to frame the JS code for clicking this element.</p>  <p>Please find the RobotFramework <strong>Execute Javascript</strong> keyword expnation on this link <a href=""https://robotframework.org/SeleniumLibrary/SeleniumLibrary.html#Execute%20Javascript"" rel=""nofollow noreferrer"">https://robotframework.org/SeleniumLibrary/SeleniumLibrary.html#Execute%20Javascript</a></p>  <p>Second Try:</p>  <pre><code>expand_xpath = ""//span[text()='Submit']//ancestor::table//a[text()='Expand']"" driver.execute_javascript(""document.evaluate('${expand_xpath}', document.body, null, 9, null).singleNodeValue.click()"") </code></pre>  <p>Output:</p>  <pre><code>JavascriptException: Message: javascript error: missing ) after argument list </code></pre>"	"<p>I'm using this method to deal with the click.</p>  <p><strong>Arguments:</strong> ele_xpath : XPATH of the element to be clicked.    </p>  <pre><code>from SeleniumLibrary import SeleniumLibrary    def click_element_with_javascript(ele_xpath):             try:                 js_exp = ""document.evaluate(\""##xpath##\"", document.body, null, 9, null).singleNodeValue.click()"".replace('##xpath##', ele_xpath)                 driver.execute_javascript(js_exp)             except Exception as e:                 print(""Element click through javascript resulted in Exception: {}"".format(e)) </code></pre>"
61593886	How to click on a WebElement using JavaScript using RobotFramework SeleniumLibrary in Python?	javascript|python|selenium|robotframework	2020-05-04 13:51:50.967000 UTC	"<p>I'm trying to click on a WebElement using JavaScript but I'm unable to create a JavaScript statement for that. </p>  <p>I'm able to click on a <strong>Cancel</strong> button using this statement</p>  <pre><code>driver.execute_javascript(""$(\""div[title='Cancel']\"")[0].click()"") </code></pre>  <p>But on clicking another element which is more complicated, I'm trying this </p>  <pre><code>expand_xpath = ""//span[text()='Submit']//ancestor::table//a[text()='Expand']"" driver.execute_javascript(""document.getElementByXpath('${expand_xpath}').click()"") </code></pre>  <p><em>JavascriptException: Message: javascript error: document.getElementByXpath is not a function</em></p>  <p>This <strong>expand_xpath</strong> is storing xpath of the WebElement which I need to click but I'm unable to frame the JS code for clicking this element.</p>  <p>Please find the RobotFramework <strong>Execute Javascript</strong> keyword expnation on this link <a href=""https://robotframework.org/SeleniumLibrary/SeleniumLibrary.html#Execute%20Javascript"" rel=""nofollow noreferrer"">https://robotframework.org/SeleniumLibrary/SeleniumLibrary.html#Execute%20Javascript</a></p>  <p>Second Try:</p>  <pre><code>expand_xpath = ""//span[text()='Submit']//ancestor::table//a[text()='Expand']"" driver.execute_javascript(""document.evaluate('${expand_xpath}', document.body, null, 9, null).singleNodeValue.click()"") </code></pre>  <p>Output:</p>  <pre><code>JavascriptException: Message: javascript error: missing ) after argument list </code></pre>"	"<p>Try clicking on element using below javaScript :   </p>  <pre><code> element= driver.find_element_by_xpath(""//span[text()='Submit']//ancestor::table//a[text()='Expand']"")  driver.execute_script(""arguments[0].click();"", element) </code></pre>  <p>OR use below: </p>  <pre><code>expand_xpath = ""//span[text()='Submit']//ancestor::table//a[text()='Expand']"" driver.execute_javascript(""document.getElementByXPath('${expand_xpath}').click()"") </code></pre>  <p>Note: ""P"" is in uppercase in <em>XPath</em>.</p>"
61618146	Python / Bokeh / Javascript / js_on_change for stacked bar and dropdown list selection	javascript|python|bokeh|bokehjs	2020-05-05 16:30:26.120000 UTC	"<p>I am struggling to understand how to incorporate js_on_change for self-embedded bokeh stacked bar graph  with dropdown selection. In a nutshell, whenever we select a value in the dropdown menu, it should map itself into a list of columns of the main dataframe that can be used then for stacked bar plotting.</p>  <p>I think I am lacking knowledge of Javascript and how to play around with it. Stackers, need your help. Below you will find the complete code that should run on your end.</p>  <p>I borrowed a little from this thread <a href=""https://stackoverflow.com/questions/46281068/bokeh-plot-a-different-column-using-customjs"">bokeh - plot a different column using customJS</a></p>  <pre><code>import pandas as pd import numpy as np import datetime  from bokeh.io import show from bokeh.layouts import row, column from bokeh.models import ColumnDataSource, CustomJS from bokeh.plotting import figure, ColumnDataSource, show from bokeh.models.widgets import Select from bokeh.models import Label, Title, NumeralTickFormatter  df = pd.DataFrame.from_dict(     {  'Apples_green': {'2018': 100, '2019': 150, '2020': 200},  'Apples_red': {'2018': 200, '2019': 75, '2020': 25},  'Oranges_green': {'2018': 25, '2019': 60, '2020': 70},  'Oranges_red': {'2018': 100, '2019': 80, '2020': 10}     }  )  #List of columns for apples initial_col = [i for i in df.columns.tolist() if i.startswith('Apples')] selection_list = [""Apples"", ""Oranges""]  d_map = {   'Apples':['Apples_green', 'Apples_red'],   'Oranges':['Oranges_green', 'Oranges_red'] }  source = ColumnDataSource(df)  p = figure(plot_width=350, plot_height = 300,         x_range=df.index.drop_duplicates().tolist()) p.vbar_stack(initial_col, x='index',  width=0.9, color=['green', 'red'], source=source) p.yaxis.formatter = NumeralTickFormatter(format='(0.00)')   select = Select(title=""Fruit:"", value=selection_list[0], options=selection_list)  select.js_on_change('value', CustomJS(args=dict(source=source, select=select, d_map = d_map), code=""""""  // print the selectd value of the select widget -   // this is printed in the browser console.  // cb_obj is the callback object, in this case the select   // widget. cb_obj.value is the selected value.  console.log(' changed selected option', cb_obj.value);    // create a new variable for the data of the column data source   // this is linked to the plot   var data = source.data;    // allocate the selected column to the field for the y values    data['{}'] = data[d_map[cb_obj.value]];    // register the change - this is required to process the change in    // the y values   source.change.emit(); """""".format(d_map[selection_list[0]])))  col = column(select) layout = row(col, p) show(layout) </code></pre>  <p>Eventually, it plots the figure but javascript part is not working.</p>  <p><a href=""https://i.stack.imgur.com/RMpD5.png"" rel=""nofollow noreferrer"">See screenshot here</a></p>"	"<p>The immediate problem with your code is the way you format the JS code string passed to <code>CustomJS</code>. It ends up being a broken JS code - you could see the error by opening your browser's JS console and changing the value of the <code>Select</code> widget.</p>  <p>As for your actual task - it's not that easy to do because <code>vbar_stack</code> is <a href=""https://github.com/bokeh/bokeh/blob/23166fd9d8232decce0ce9219812e570e83d8412/bokeh/plotting/figure.py#L1294-L1297"" rel=""nofollow noreferrer"">not a real glyph function</a>. Instead, it's just a helper function that calls the <code>vbar</code> glyph function with the necessary parameters. Your call to <code>p.vbar_stack(...)</code> effectively becomes</p>  <pre class=""lang-py prettyprint-override""><code>p.vbar(bottom=stack(), top=stack('Apples_green'),        x='index', width=0.9, color='green', source=source) p.vbar(bottom=stack('Apples_green'), top=stack('Apples_green', 'Apples_red'),        x='index', width=0.9, color='red', source=source) </code></pre>  <p>That means that in order to change the columns which the expressions used by the <code>VBar</code> glyphs use, you will have to basically convert that Bokeh Python code into BokehJS JavaScript code.</p>  <p>With that being said, here's a working version of your code that should work for any number of colors, not just two:</p>  <pre class=""lang-py prettyprint-override""><code>import pandas as pd  from bokeh.layouts import row, column from bokeh.models import CustomJS from bokeh.models import NumeralTickFormatter from bokeh.models.widgets import Select from bokeh.plotting import figure, ColumnDataSource, show from bokeh.transform import stack  df = pd.DataFrame.from_dict(     {         'Apples_green': {'2018': 100, '2019': 150, '2020': 200},         'Apples_red': {'2018': 200, '2019': 75, '2020': 25},         'Oranges_green': {'2018': 25, '2019': 60, '2020': 70},         'Oranges_red': {'2018': 100, '2019': 80, '2020': 10}     } )  d_map = {     'Apples': ['Apples_green', 'Apples_red'],     'Oranges': ['Oranges_green', 'Oranges_red'] }  selection_list = list(d_map.keys())  # In modern Python, dicts are ordered by default. initial_value = selection_list[0] initial_col = [i for i in df.columns.tolist() if i.startswith(initial_value)]  source = ColumnDataSource(df)  p = figure(plot_width=350, plot_height=300,            x_range=df.index.drop_duplicates().tolist()) renderers = [] col_acc = [] for col in d_map[initial_value]:     color = col[len(initial_value) + 1:]     r = p.vbar(bottom=stack(*col_acc), top=stack(col, *col_acc),                x='index', width=0.9, color=color, source=source)     col_acc.append(col)     renderers.append(r) p.yaxis.formatter = NumeralTickFormatter(format='(0.00)')  select = Select(title=""Fruit:"", value=initial_value, options=selection_list)  select.js_on_change('value', CustomJS(args=dict(d_map=d_map, renderers=renderers),                                       code=""""""     const Stack = Bokeh.Models('Stack');     const col_acc = [];     d_map[cb_obj.value].forEach((col, idx) =&gt; {         const {glyph} = renderers[idx];         glyph.bottom = {expr: new Stack({fields: col_acc})};         col_acc.push(col);         glyph.top = {expr: new Stack({fields: col_acc})};     }); """"""))  col = column(select) layout = row(col, p) show(layout) </code></pre>"
61629408	Python body.encode( ) Javascript alternative	javascript|python|node.js|sha256|plaid	2020-05-06 07:14:35.707000 UTC	"<p>I'm trying to verify a webhook coming from Plaid in NodeJS by calculating the Sha256 of the webhook body and I'm following a Python code <a href=""https://support.plaid.com/hc/en-us/articles/360041410794"" rel=""nofollow noreferrer"">here</a> where the code is showing :</p>  <pre><code>   # Compute the has of the body.    m = hashlib.sha256()    m.update(body.encode())    body_hash = m.hexdigest()  </code></pre>  <p>What's the alternative of body.encode() in Javascript before passing it to the Sha256 function please ? Note that the body I'm getting is an object containing the following data : </p>  <blockquote>   <p>{ error: null,   item_id: '4zAGyokJ1XiWP63QNl1RuLZV76o55nudVXzNG',<br>   new_transactions: 0,   webhook_code: 'DEFAULT_UPDATE',   webhook_type:   'TRANSACTIONS' }</p> </blockquote>  <p>However I'm trying to get this hash : </p>  <blockquote>   <p>b05ef560b59e8d8e427433c5e0f6a11579b5dfe6534257558b896f858007385a</p> </blockquote>"	"<p>So, if the body is JSON <strong>(NOT JSON STRING)</strong> then you need to stringify it and put it in the <code>.update</code> function As the <code>m.body</code> takes a string. If you have your body as <strong>STRING</strong> then just put it in as is.</p>  <p>This is from the Crypto Example <a href=""https://nodejs.org/api/crypto.html#crypto_class_hash"" rel=""nofollow noreferrer"">here</a>:</p>  <pre><code>const crypto = require('crypto'); const hash = crypto.createHash('sha256');  const stringBody = JSON.stringify(body); hash.update(stringBody); console.log(hash.digest('hex')); </code></pre>  <p><strong>Edit:</strong><br> If the hash is not same then maybe you need to correct the newlines or whitespaces. You need to make both bodies exactly the same. Here In the below example I am using same exact string and encoding using Python AND NodeJS.</p>  <pre><code>import hashlib body = '{""error"":null,""item_id"":""4zAGyokJ1XiWP63QNl1RuLZV76o55nudVXzNG"",""new_transactions"":0,""webhook_code"":""DEFAULT_UPDATE"",""webhook_type"":""TRANSACTIONS""}' m = hashlib.sha256() m.update(body.encode()) body_hash = m.hexdigest() print(body_hash) </code></pre>  <p><strong>Output:</strong></p>  <pre><code>python3 file.py 26f1120ccaf99a383b7462b233e18994d0c06d4585e3fe9a91a449e97a1c03ba </code></pre>  <p><strong>And Using NodeJS:</strong></p>  <pre><code>const crypto = require('crypto'); const hash = crypto.createHash('sha256'); const body = {   error: null,   item_id: '4zAGyokJ1XiWP63QNl1RuLZV76o55nudVXzNG',   new_transactions: 0,   webhook_code: 'DEFAULT_UPDATE',   webhook_type: 'TRANSACTIONS' }  const stringBody = JSON.stringify(body); hash.update(stringBody); console.log(hash.digest('hex')); </code></pre>  <p><strong>Output:</strong></p>  <pre><code>node file.js 26f1120ccaf99a383b7462b233e18994d0c06d4585e3fe9a91a449e97a1c03ba </code></pre>"
61662055	Selenium Python - javascript function call	javascript|python|selenium	2020-05-07 15:47:37.517000 UTC	"<p>how can i call a javascript function in Selenium Python?</p>  <p>I'm trying to click on a button like this:</p>  <pre><code>&lt;a href=""javascript:;"" class=""btndefault j-open-game j-gamingButton"" data-gameid=""1280"" data-productid=""2"" ...&gt;  </code></pre>  <p>But if i search it with:</p>  <pre><code>btn = browser.find_element_by_class_name('btndefault j-open-game j-gamingButton') </code></pre>  <p>I receive:</p>  <pre><code>selenium.common.exceptions.NoSuchElementException: Message: no such element: Unable to locate element: {""method"":""css selector"",""selector"":"".btndefault j-open-game j-gamingButton""} </code></pre>  <p>if i search it with:</p>  <pre><code>btn = browser.find_element_by_xpath(""//button[@name='j-gamingButton']"") </code></pre>  <p>I receive:</p>  <pre><code>selenium.common.exceptions.NoSuchElementException: Message: no such element: Unable to locate element: {""method"":""xpath"",""selector"":""//button[@name='j-gamingButton']""} </code></pre>  <p>if i search it with:</p>  <pre><code>btn = browser.find_element_by_xpath(""//button[@name='j-btndefault j-open-game j-gamingButton']"") </code></pre>  <p>I receive:</p>  <pre><code>selenium.common.exceptions.NoSuchElementException: Message: no such element: Unable to locate element: {""method"":""xpath"",""selector"":""//button[@name='j-btndefault j-open-game j-gamingButton']""} </code></pre>  <p>if i search it with:</p>  <pre><code>btn = browser.find_element_by_xpath(""//button[@class='j-btndefault j-open-game j-gamingButton']"") </code></pre>  <p>I receive:</p>  <pre><code>selenium.common.exceptions.NoSuchElementException: Message: no such element: Unable to locate element: </code></pre>  <p>Do you have any suggestions for me? Thanks in advance</p>"	
61686095	javascript python 3 jsonResponse undefined	javascript|python-3.x|flask|sqlalchemy	2020-05-08 18:53:21.270000 UTC	"<p>I'm trying to send a post request to my server and then instantly update the webpage to display the user input.  It looks like the POST request is going through because when I refresh the page the user input is displayed and the correct data has been inserted into my database.  The problem is that when I submit the form the page displays undefined data.  I can't update the item or delete it until I refresh the page.  Why isn't the submitted data showing on the page right away?  This is my relevant code.</p>  <p>index.html:</p>  <pre><code>      const descInput = document.getElementById('description');       document.getElementById('form').onsubmit = function(e) {         e.preventDefault();         const desc = descInput.value;         descInput.value = '';         response = fetch('/todos/create', {           method: 'POST',           body: JSON.stringify({             'description': desc,           }),           headers: {             'Content-Type': 'application/json',           }         })         .then(response =&gt; {             return response.json()         })         .then(jsonResponse =&gt; {           const li = document.createElement('li');           const checkbox = document.createElement('input');           checkbox.className = 'check-completed';           checkbox.type = 'checkbox';           checkbox.setAttribute('data-id', jsonResponse.id);           li.appendChild(checkbox);            const text = document.createTextNode(' ' + jsonResponse.description);           li.appendChild(text);            const deleteBtn = document.createElement('button');           deleteBtn.className = 'delete-button';           deleteBtn.setAttribute('data-id', jsonResponse.id);           deleteBtn.innerHTML = '&amp;cross;';           li.appendChild(deleteBtn);            document.getElementById('todos').appendChild(li);           document.getElementById('error').className = 'hidden';         })         .catch(function() {           console.error('Error occurred');           document.getElementById('error').className = '';         })       } </code></pre>  <p>app.py:</p>  <pre><code>@app.route('/todos/create', methods=['POST']) def create_todo():     error = False     body = {} #   description = request.form.get('description', '') #   return render_template('index.html')     try:         description = request.get_json()['description']         todo = Todo(description=description)         #body['description'] = todo.description         db.session.add(todo)         db.session.commit()     except:         error=True         db.session.rollback()         print(sys.exc_info())     finally:         db.session.close()     if error:         abort (400)     else:         return jsonify(body) </code></pre>"	<p>I got it.  I wasn't setting my json object with the necessary attributes and returning it in app.py</p>
61693762	Python selenium how to confirm the javascript message to open whatsapp Web	javascript|python|selenium-webdriver	2020-05-09 08:21:18.100000 UTC	"<p>I'm making WhatsApp automation script to send a message. When I run the script it asks the javascript confirm to open WhatsApp web.</p>  <p>How I can do that.?</p>  <p>My code :</p>  <pre class=""lang-py prettyprint-override""><code>from selenium import webdriver import pandas as pd from selenium.webdriver.common.by import By from selenium.webdriver.common.keys import Keys import time import os import mysql.connector    driver = webdriver.Chrome('/Users/evilslab/Downloads/chromedriver 3')  driver.get('https://api.whatsapp.com/send?phone=0097155000XXXX)  # Click the link to activate the alert driver.find_element(By.LINK_TEXT, ""https://api.whatsapp.com wants to open this application."").click()    # Store the alert in a variable for reuse alert = driver.switch_to.alert  # Store the alert text in a variable text = alert.text  # Press the Cancel button alert.dismiss()  </code></pre>  <p>This not confirming that</p>"	
61700139	run a javascript function inside a python	javascript|python|django|string|django-templates	2020-05-09 16:30:45.067000 UTC	"<p>I'm working on a project. I have a <code>strings.py</code> which has <code>dicts</code> like below:</p>  <pre><code>def bar(self):     #do something   STRINGS_ENGLISH = {      'title': 'foo'      'function': bar } </code></pre>  <p>then I wanna use this string in my Django template, I'll pass it through my context in the template named <code>string</code>. </p>  <p><strong>I know that If I wanna print the <code>title</code> in the HTML it's enough to write <code>{{strings.title}}</code>,</strong></p>  <p>but about the function I want to pass it to a button like that:</p>  <pre><code>&lt;button onclick=""{function()}""&gt;Do Something&lt;/button&gt; </code></pre>  <p>but it's a python function! not a js function. so what should I do? </p>"	
