11340220	Dynamically generate client-side HTML form control using JavaScript and server-side Python code in Google App Engine	javascript|python|google-app-engine	2012-07-05 08:05:56.900000 UTC	"<p>I have the following client-side front-end HTML using Jinja2 template engine:</p>  <pre><code>{% for record in result %}     &lt;textarea name=""remark""&gt;{{ record.remark }}&lt;/textarea&gt;     &lt;input type=""submit"" name=""approve"" value=""Approve"" /&gt; {% endfor %} </code></pre>  <p>Thus the HTML may show more than 1 set of textarea and submit button. </p>  <p>The back-end Python code retrieves a variable number of records from a gql query using the model, and pass this to the Jinja2 template in result. When a submit button is clicked, it triggers the post method to update the record:</p>  <pre><code>def post(self):     if self.request.get('approve'):         updated_remark = self.request.get('remark')         record.remark = db.Text(updated_remark)         record.put() </code></pre>  <p>However, in some instances, the record updated is NOT the one that correspond to the submit button clicked (eg if a user clicks on record 1 submit, record 2 remark gets updated, but not record 1).</p>  <p>I gather that this is due to the duplicate attribute name remark. I can possibly use JavaScript/jQuery to generate different attribute names. The question is, how do I code the back-end Python to get the (variable number of) names generated by the JavaScript?</p>  <p>Thanks.</p>"	11340797	"<p><strong>edited</strong></p>  <p>Inside the template <strong>for</strong> loop use <a href=""http://jinja.pocoo.org/docs/templates/#list-of-control-structures"" rel=""nofollow"">loop.index</a>: the current iteration of the loop. </p>  <p>Then:</p>  <pre><code>{% for record in result %} &lt;textarea name=""remark{{ loop.index }}""&gt;{{ record.remark }}&lt;/textarea&gt; &lt;input type=""submit"" name=""approve"" value=""{{ loop.index }}"" /&gt; {% endfor %} </code></pre>  <p>return:</p>  <pre><code>&lt;textarea name=""remark1""&gt;first record remark&lt;/textarea&gt; &lt;input type=""submit"" name=""approve"" value=""1"" /&gt; &lt;textarea name=""remark2""&gt;second record remark&lt;/textarea&gt; &lt;input type=""submit"" name=""approve"" value=""2"" /&gt; &lt;textarea name=""remark2""&gt;third record remark&lt;/textarea&gt; &lt;input type=""submit"" name=""approve"" value=""3"" /&gt; </code></pre>  <p>and in your backend code:</p>  <pre><code>def post(self):     if self.request.get('approve'):         updated_remark = self.request.get('remark' + self.request.get('approve'))         record.remark = db.Text(updated_remark)         record.put() </code></pre>  <p>I wrote this without testing it. Probably doesn't work, but could give you a hint. </p>  <hr>  <p><strong>new [better] solution</strong></p>  <p>put each couple of textarea and input inside an form:</p>  <pre><code>{% for record in result %}     &lt;form&gt;         &lt;textarea name=""remark""&gt;{{ record.remark }}&lt;/textarea&gt;         &lt;input type=""submit"" name=""approve"" value=""Approve"" /&gt;    &lt;/form&gt; {% endfor %} </code></pre>"
11383796	getting javascript form content with python	javascript|python|xml|forms	2012-07-08 14:14:10.803000 UTC	"<p>I am a novice python programmer and I am having troubles finding a tool to help me get a form from a javascript. I have written a small script in python and also have a simple interface done in javascript. The user needs to select a few items in the browser and the javascript then returns a sendForm(). I would like to then to recover the form with my python script. I know I could generate an xml file with javascript and tell my python script to wait until its creation and then catch it (with a os.path.exist(..)) but i would like to avoid this. I have seen that libraries such as cgi, mechanize, pyjs,(selenium?) exist to interface python and html,javascript but I can't find which one to use or if there would be another tool that would handle recovering the form easily.</p>  <p>More info: the python script generates an xml which is read by javascript. The user selects items in the javascript (with checkboxes) which are then tagged in the xml by javascript. The javascript then outputs the modified xml in a hidden field and it is this modified xml that I wish to retrieve with my python script after it is created.</p>  <p>Thank you all a  lot for your  help</p>"	11383885	"<p>Is your system a web application, If so your javascript can post to python back-end using ajax. Then you can encrypt a form to json string and send to back-end, in back en you can parse that string into python variable... Javascript it self does not have access to your local file except you run it local (but it's really limitted)</p>  <p>I suggest you should try a web frame work like Django. It's easy to learn in one day. </p>"
11383796	getting javascript form content with python	javascript|python|xml|forms	2012-07-08 14:14:10.803000 UTC	"<p>I am a novice python programmer and I am having troubles finding a tool to help me get a form from a javascript. I have written a small script in python and also have a simple interface done in javascript. The user needs to select a few items in the browser and the javascript then returns a sendForm(). I would like to then to recover the form with my python script. I know I could generate an xml file with javascript and tell my python script to wait until its creation and then catch it (with a os.path.exist(..)) but i would like to avoid this. I have seen that libraries such as cgi, mechanize, pyjs,(selenium?) exist to interface python and html,javascript but I can't find which one to use or if there would be another tool that would handle recovering the form easily.</p>  <p>More info: the python script generates an xml which is read by javascript. The user selects items in the javascript (with checkboxes) which are then tagged in the xml by javascript. The javascript then outputs the modified xml in a hidden field and it is this modified xml that I wish to retrieve with my python script after it is created.</p>  <p>Thank you all a  lot for your  help</p>"	11396801	"<p>Thanks for the clarification in the comments.  Since you are building a website, you'll want to use AJAX to call the python web application and return something (probably XML in your case, although I recommend reading about JSON).  It sounds to me like you don't have the best solution to your problem yet, but that is another issue.  I don't understand why you would go to the trouble of generating xml with python, reading it with JavaScript, updating it with JavaScript, and then reading it again with Python on form submission.  For starters, think about what happens if your users disable JavaScript.</p>  <p>Anyways, I suggest reading about <a href=""http://flask.pocoo.org/"" rel=""nofollow"">Flask</a> and <a href=""http://jquery.com/"" rel=""nofollow"">jQuery</a> to get started.  Your application might then look something like this in python:</p>  <pre><code>from flask import Flask app = Flask(__name__)  @app.route('/', methods=['POST', 'GET']) def foo():     if request.method == 'GET':         # Generate the XML         return myXML     if request.method == 'POST':         # Read that hidden field         xml = request.form['the_hidden_xml']         # Do what you will         return render_template('homepage.html')  if __name__ == ""__main__"":     app.run() </code></pre>  <p>The JavaScipt probably does this:</p>  <pre><code>function buildTheForm() {     $.get('/', function(data) {         // handle the xml in data         alert('Load was performed.');     }); } </code></pre>  <p>The form probably does this:</p>  <pre><code>&lt;form action=""/"" method=""post""&gt; </code></pre>"
11402361	python's urllib.urlopen for javascript	javascript|python|urllib	2012-07-09 20:12:15.380000 UTC	"<p>Is there a module written in javascript that's equivalent to python's urllib?  In particular, I want something like:</p>  <pre><code>urllib.urlopen(url, data) </code></pre>  <p>which returns an object that supports a blocking fetch.  Alternatively, in what other ways could I perform a blocking request to a server using javascript?</p>"	11402618	"<p>You can use the normal XMLHttpRequest synchronously:</p>  <pre><code>var xhr = new XMLHttpRequest(); xhr.open('POST', url, false);  # third param is sync/async xhr.send(data); var response = xhr.responseText; </code></pre>"
11483002	Is there a JavaScript or posssibly Python/Django web service to geocode street addresses?	javascript|python|api|geolocation|geocoding	2012-07-14 10:30:29.440000 UTC	"<p>Is there a generic JavaScript or possibly Python/Django or other open source web service or API to look up a geolocation given a street address? <a href=""http://www.braincastexception.com/wp7-web-services-first-part-geocodeservice/"" rel=""nofollow"">http://www.braincastexception.com/wp7-web-services-first-part-geocodeservice/</a> does what I want, apparently in C#. Is the like available from JavaScript or open source projects that can be queried?</p>  <p>ATdhvaanckse,</p>"	11483114	"<p>You can use <a href=""https://developers.google.com/maps/documentation/javascript/"" rel=""nofollow"">Google Maps JavaScript API</a>. You can find an example of what you want <a href=""https://google-developers.appspot.com/maps/documentation/javascript/examples/geocoding-simple"" rel=""nofollow"">here</a>.</p>"
11483002	Is there a JavaScript or posssibly Python/Django web service to geocode street addresses?	javascript|python|api|geolocation|geocoding	2012-07-14 10:30:29.440000 UTC	"<p>Is there a generic JavaScript or possibly Python/Django or other open source web service or API to look up a geolocation given a street address? <a href=""http://www.braincastexception.com/wp7-web-services-first-part-geocodeservice/"" rel=""nofollow"">http://www.braincastexception.com/wp7-web-services-first-part-geocodeservice/</a> does what I want, apparently in C#. Is the like available from JavaScript or open source projects that can be queried?</p>  <p>ATdhvaanckse,</p>"	11483144	"<p>Check out <a href=""http://www.gisgraphy.com/"" rel=""nofollow"">Gisgraphy</a> a free an open source geo service.</p>  <p>Everyone will tell you to use the Google Maps API but read the <a href=""https://developers.google.com/maps/terms"" rel=""nofollow"">terms of use</a>.</p>  <blockquote>   <p>(g) No Use of Content without a Google Map. You must not use or   display the Content without a corresponding Google map, unless you are   explicitly permitted to do so in the Maps APIs Documentation, or   through written permission from Google. In any event, you must not use   or display the Content on or in conjunction with a non-Google map. For   example, you must not use geocodes obtained through the Service in   conjunction with a non-Google map. As another example, you must not   display Street View imagery alongside a non-Google map, but you may   display Street View imagery without a corresponding Google map because   the Maps APIs Documentation explicitly permits you to do so.</p> </blockquote>  <p>So with the Google API you <strong>must use a Google Map</strong>. So if you need a map you're OK.</p>"
11483002	Is there a JavaScript or posssibly Python/Django web service to geocode street addresses?	javascript|python|api|geolocation|geocoding	2012-07-14 10:30:29.440000 UTC	"<p>Is there a generic JavaScript or possibly Python/Django or other open source web service or API to look up a geolocation given a street address? <a href=""http://www.braincastexception.com/wp7-web-services-first-part-geocodeservice/"" rel=""nofollow"">http://www.braincastexception.com/wp7-web-services-first-part-geocodeservice/</a> does what I want, apparently in C#. Is the like available from JavaScript or open source projects that can be queried?</p>  <p>ATdhvaanckse,</p>"	11484336	"<p>You can circumvent the restrictive TOS that Google, Bing, and other providers have by using <a href=""http://smartystreets.com/products/liveaddress-api"" rel=""nofollow"">LiveAddress API</a>. I work at <a href=""http://smartystreets.com"" rel=""nofollow"">SmartyStreets</a> and help to maintain it.</p>  <p>While Google will only approximate the address (in other words, return results for addresses which don't exist), LiveAddress will verify the existence of the address and return only valid results, and a handful of other valuable data about it.</p>  <p>Python sample code here: <a href=""https://github.com/smartystreets/LiveAddressSamples/tree/master/python"" rel=""nofollow"">https://github.com/smartystreets/LiveAddressSamples/tree/master/python</a></p>  <p>Javascript examples here: <a href=""http://jsfiddle.net/user/smartystreets/fiddles/"" rel=""nofollow"">http://jsfiddle.net/user/smartystreets/fiddles/</a> and <a href=""https://github.com/smartystreets/LiveAddressSamples/tree/master/jQuery"" rel=""nofollow"">https://github.com/smartystreets/LiveAddressSamples/tree/master/jQuery</a> (uses jQuery) and <a href=""https://github.com/smartystreets/LiveAddressSamples/tree/master/javascript"" rel=""nofollow"">https://github.com/smartystreets/LiveAddressSamples/tree/master/javascript</a>.</p>"
11511155	Python Javascript framework to use with cherrypy and Mako	javascript|jquery|python|mako	2012-07-16 19:26:20.380000 UTC	"<p>I am just learning python and python web apps so please forgive my lack of knowledge.</p>  <p>I am writing a web app in python with cherrypy + mako (+ html), and now I am diving into the javascript part of it. Honestly, the rest was already enough to learn... So I was wondering about using a python framework to sort of abstract the javascript syntax from me. (I am mostly a c* dev, python is already different enough to keep me busy)</p>  <p>I don't (yet) need any fancy javascript, although I have already started using jquery and jquery-ui, but I don't understand the syntax well enough and it takes me a long time to do anything... (For example I have not yet found how to get the javascript and mako to interact with each other in a client server way.)</p>  <p>I have learned about pyjamas and other frameworks as such. What would you recommend?</p>"	11511725	"<p>It all depends on what you need the server and client to communicate about.  If you give us a specific problem we can give more specific answers.  </p>  <p>Here's a javascript ajax call.  It's straight javascript (no framework) and what you would refer to as ""not fancy"".</p>  <pre><code>function AddToCart_Clicked(SKU, Quantity) {     // code for IE7+, Firefox, Chrome, Opera, Safari     if(window.XMLHttpRequest)         xmlhttp=new XMLHttpRequest();     else// code for IE6, IE5         xmlhttp=new ActiveXObject(""Microsoft.XMLHTTP"");      xmlhttp.onreadystatechange=function()     {         if (xmlhttp.readyState==4 &amp;&amp; xmlhttp.status==200)         {             document.getElementById('HeaderShoppingCartlink').innerHTML = 'Shopping Cart (' + xmlhttp.responseText + ')';         }     }      xmlhttp.open(""GET"",""/ProductNavigation/AddToCartJS?SKU="" + SKU + ""&amp;Quantity="" + Quantity, true);     xmlhttp.send();     } </code></pre>  <p>This function adds an item to a user's shopping cart.  The function sends a GET request to the Cherrypy function AddToCartJS in the class ProductNavigation with the variables SKU and Quantity.  The CherryPy function looks like this.</p>  <pre><code>@cherrypy.expose def AddToCartJS(self, SKU, Quantity):     CurrentShoppingCart = ShoppingCart()     CartID = CurrentShoppingCart.AddToCart(SKU, Quantity)     return CurrentShoppingCart.GetCartCount() </code></pre>  <p>Hope this helps.</p>  <p>Andrew</p>"
11540314	Python to JavaScript object graph (de)serialization	javascript|python|serialization|deserialization	2012-07-18 11:30:52.087000 UTC	"<p>I'm trying to send an object graph from Python to JavaScript running in a browser, and I was wondering whether there is a pair of ready-to-use libraries for handling serialization on the Python side and deserialization on the JavaScript side. JSON does not support object references out of the box, the docs for JS-YAML say it's not production-ready in a browser environment, and I didn't find anything for XML. Any suggestions?</p>  <p><strong>edit:</strong> Here's an example for what I mean by ""JSON does not support object references out of the box"": I have a shop database with products and orders and a many-to-many relationship between them. If I put a bunch of orders into the Python JSON serializer, the result will contain multiple serializations (copies) of each product, because the JSON serializer has no way of saying, ""I've serialized this product already, so I'll just insert a reference to it"". So I put the result on the wire and deserialize it on the client, and now I have multiple JavaScript objects representing the same product, which is bad.</p>"	11568548	"<p>how about jsonpickle? JS is awesome with json out of box, adding json pickling in python is the missing link: <a href=""http://pypi.python.org/pypi/jsonpickle/"" rel=""nofollow"">jsonpickle</a></p>"
11547150	How to transfer variable data from Python to Javascript without a web server?	javascript|python|html|file	2012-07-18 17:37:08.290000 UTC	"<p>I'm working on automatically generating a local HTML file, and all the relevant data that I need is in a Python script. Without a web server in place, I'm not sure how to proceed, because otherwise I think an AJAX/json solution would be possible. </p>  <p>Basically in python I have a few list and dictionary objects that I need to use to create graphs using javascript and HTML. One solution I have (which really sucks) is to literally write HTML/JS from within Python using strings, and then save to a file.</p>  <p>What else could I do here? I'm pretty sure Javascript doesn't have file I/O capabilities.</p>  <p>Thanks.</p>"	11547227	"<p>What do you thing about using some <a href=""http://wiki.python.org/moin/Templating"" rel=""nofollow"">Templating</a> system? It will fit your needs.</p>"
11547150	How to transfer variable data from Python to Javascript without a web server?	javascript|python|html|file	2012-07-18 17:37:08.290000 UTC	"<p>I'm working on automatically generating a local HTML file, and all the relevant data that I need is in a Python script. Without a web server in place, I'm not sure how to proceed, because otherwise I think an AJAX/json solution would be possible. </p>  <p>Basically in python I have a few list and dictionary objects that I need to use to create graphs using javascript and HTML. One solution I have (which really sucks) is to literally write HTML/JS from within Python using strings, and then save to a file.</p>  <p>What else could I do here? I'm pretty sure Javascript doesn't have file I/O capabilities.</p>  <p>Thanks.</p>"	11547300	"<p>I know you've specifically mentioned ""without a web-server"", but unless you want to really go out of your way, and over-complicate this, and restrict flexibility for future use:-</p>  <p>Could you not use a very simple webserver such as: <a href=""http://docs.python.org/library/simplehttpserver.html"" rel=""nofollow"">http://docs.python.org/library/simplehttpserver.html</a> ? That way, should you need to expose the site, you've got the URL's already in place to set-up a proper webserver.</p>"
11547150	How to transfer variable data from Python to Javascript without a web server?	javascript|python|html|file	2012-07-18 17:37:08.290000 UTC	"<p>I'm working on automatically generating a local HTML file, and all the relevant data that I need is in a Python script. Without a web server in place, I'm not sure how to proceed, because otherwise I think an AJAX/json solution would be possible. </p>  <p>Basically in python I have a few list and dictionary objects that I need to use to create graphs using javascript and HTML. One solution I have (which really sucks) is to literally write HTML/JS from within Python using strings, and then save to a file.</p>  <p>What else could I do here? I'm pretty sure Javascript doesn't have file I/O capabilities.</p>  <p>Thanks.</p>"	11547335	"<p>Maybe you could write to a cookie and then access that via JavaScript? Similar to this SO answer <a href=""https://stackoverflow.com/a/4349222/5926"">here</a>?</p>"
11547150	How to transfer variable data from Python to Javascript without a web server?	javascript|python|html|file	2012-07-18 17:37:08.290000 UTC	"<p>I'm working on automatically generating a local HTML file, and all the relevant data that I need is in a Python script. Without a web server in place, I'm not sure how to proceed, because otherwise I think an AJAX/json solution would be possible. </p>  <p>Basically in python I have a few list and dictionary objects that I need to use to create graphs using javascript and HTML. One solution I have (which really sucks) is to literally write HTML/JS from within Python using strings, and then save to a file.</p>  <p>What else could I do here? I'm pretty sure Javascript doesn't have file I/O capabilities.</p>  <p>Thanks.</p>"	11547359	"<p>You could use Python's JSON Encoder and Decoder library. This way you could encode your Python data into JSON format and include that in your HTML document. You would then use Javascript in the HTML file to work with the JSON encoded data.</p>  <p><a href=""http://docs.python.org/library/json.html"" rel=""nofollow"">http://docs.python.org/library/json.html</a></p>"
11547150	How to transfer variable data from Python to Javascript without a web server?	javascript|python|html|file	2012-07-18 17:37:08.290000 UTC	"<p>I'm working on automatically generating a local HTML file, and all the relevant data that I need is in a Python script. Without a web server in place, I'm not sure how to proceed, because otherwise I think an AJAX/json solution would be possible. </p>  <p>Basically in python I have a few list and dictionary objects that I need to use to create graphs using javascript and HTML. One solution I have (which really sucks) is to literally write HTML/JS from within Python using strings, and then save to a file.</p>  <p>What else could I do here? I'm pretty sure Javascript doesn't have file I/O capabilities.</p>  <p>Thanks.</p>"	11547371	"<p>You just need to get the data you have in your python code into a form readable by your javascript, right?</p>  <p>Why not just take the data structure, convert it to JSON, and then write a <code>.js</code> file that your <code>.html</code> file includes that is simply <code>var data = { json: ""object here"" };</code></p>"
11547150	How to transfer variable data from Python to Javascript without a web server?	javascript|python|html|file	2012-07-18 17:37:08.290000 UTC	"<p>I'm working on automatically generating a local HTML file, and all the relevant data that I need is in a Python script. Without a web server in place, I'm not sure how to proceed, because otherwise I think an AJAX/json solution would be possible. </p>  <p>Basically in python I have a few list and dictionary objects that I need to use to create graphs using javascript and HTML. One solution I have (which really sucks) is to literally write HTML/JS from within Python using strings, and then save to a file.</p>  <p>What else could I do here? I'm pretty sure Javascript doesn't have file I/O capabilities.</p>  <p>Thanks.</p>"	11547536	"<p>If this only needs to be for localhost, you could do something like the following. To access, you would make a call to <code>http://localhost:8080/foo</code>; this can cause some issues due to Cross Site Injection Protection, however; these are readily solved by Googling around.</p>  <p>On the JS side, you would make an AJAX call like this (assuming jQuery)</p>  <pre><code>$.ajax('http://localhost:8080/foo', function (data) {console.log(data)}); </code></pre>  <p>And then on the Python side you would have this file in the same directory as the html file you are seeking to use (index.html) on your computer, and execute it.</p>  <pre><code>import BaseHTTPServer import json  class WebRequestHandler(BaseHTTPServer.BaseHTTPRequestHandler):         def do_GET(self):             desiredDict = {'something':'sent to JS'}             if self.path == '/foo':                 self.send_response(200)                 self.send_header(""Content-type"", ""application/json"")                 self.end_headers()                 self.wfile.write(json.dumps(desiredDict))             else:                  if self.path == '/index.html' or self.path == '/':                     htmlFile = open('index.html', 'rb')                     self.send_response(200)                     self.send_header(""Content-type"", ""text/html"")                     self.send_header(""Access-Control-Allow-Origin"",""http://localhost:8080/"")                     self.end_headers()                     self.wfile.write(htmlFile.read())                 else:                     self.send_error(404)  server = BaseHTTPServer.HTTPServer(('',8080), WebRequestHandler) server.serve_forever() </code></pre>"
