60407130	Effective Python equivalent of this simple promise-chaining JavaScript class	python-3.x|promise|queue|python-asyncio	2020-02-26 05:06:40.140000 UTC	"<p>Here's the JavaScript code:</p>  <pre class=""lang-js prettyprint-override""><code>class TaskQueue {   constructor() {     this._chain = Promise.resolve();   }   postTask(task) {     const result = this._chain.then(task);     this._chain = result.catch(() =&gt; {});     return result;   } } </code></pre>  <p>I'm pretty sure that this just takes a task (function), gets the Promise from it, ignores the errors, and adds it onto the class 'chain'. I'm not quite sure exactly why, though. <a href=""https://github.com/puppeteer/puppeteer/blob/master/lib/TaskQueue.js"" rel=""nofollow noreferrer"">Here's the file</a> in question, and <a href=""https://github.com/puppeteer/puppeteer/blob/master/lib/Page.js#L917"" rel=""nofollow noreferrer"">here</a> is where you can find it being used. In the usage it seems like there's really no need for queuing system to me.</p>  <p>I have no clue what do in Python. I'm aware that there is no 'exact' equivalent to this style of Python code, but I'd like to replicate it effectively, or at least achieve the same results as the JS even if by a different method.</p>"	"<p>Here is an example of a Javacript Promise copy:</p> <pre><code>class Promise:     def __init__(self, callback):         self.resolved = ''         self.rejected = ''         if callable(callback):             callback(self.resolve, self.reject)      def resolve(self, value):         self.resolved = value      def reject(self, value):         self.rejected = value      def then(self, callback):         if not self.rejected:             self.resolved = callback(self.resolved)         return self      def catch(self, callback):         if self.rejected:             self.rejected = callback(self.rejected)         return self      def all(self, promises):         resolvedArray = []         rejectedArray = []         for promise in promises:             promise(self.resolve, self.reject)             if self.resolved:                 resolvedArray += self.resolved             if self.rejected:                 rejectedArray += self.rejected                 break         self.resolved = resolvedArray         self.rejected = rejectedArray         return self   def myPromise1(resolve, reject):     resolve(['Ana'])   def myPromise2(resolve, reject):     resolve(['Bia'])   def myPromise3(resolve, reject):     resolve(['Carlos'])   def myPromise4(resolve, reject):     resolve(['Daniel'])   def allResolve(values):     print('without error: ', values)   def allReject(values):     print('with error: ', values)   p = Promise([]) p.all([myPromise1, myPromise2]).then(allResolve).catch(allReject) </code></pre> <p>Another example:</p> <pre><code>def myPromise(resolve, reject):     resolve(['Ana', 'Bia', 'Carlos', 'Daniel'])   def firstResolve(value):     return value[0]   def secondResolve(value):     print(value)   def firstReject(value):     print('error:', value)   p = Promise(myPromise) p.then(firstResolve).then(secondResolve).catch(firstReject) </code></pre>"
60407130	Effective Python equivalent of this simple promise-chaining JavaScript class	python-3.x|promise|queue|python-asyncio	2020-02-26 05:06:40.140000 UTC	"<p>Here's the JavaScript code:</p>  <pre class=""lang-js prettyprint-override""><code>class TaskQueue {   constructor() {     this._chain = Promise.resolve();   }   postTask(task) {     const result = this._chain.then(task);     this._chain = result.catch(() =&gt; {});     return result;   } } </code></pre>  <p>I'm pretty sure that this just takes a task (function), gets the Promise from it, ignores the errors, and adds it onto the class 'chain'. I'm not quite sure exactly why, though. <a href=""https://github.com/puppeteer/puppeteer/blob/master/lib/TaskQueue.js"" rel=""nofollow noreferrer"">Here's the file</a> in question, and <a href=""https://github.com/puppeteer/puppeteer/blob/master/lib/Page.js#L917"" rel=""nofollow noreferrer"">here</a> is where you can find it being used. In the usage it seems like there's really no need for queuing system to me.</p>  <p>I have no clue what do in Python. I'm aware that there is no 'exact' equivalent to this style of Python code, but I'd like to replicate it effectively, or at least achieve the same results as the JS even if by a different method.</p>"	"<p><code>then</code> creates a new promise which runs after the old one resolves. In Python you can create a task whose coroutine awaits the previous one. Something like:</p>  <pre class=""lang-py prettyprint-override""><code>class TaskQueue:     def __init__(self):         fut = asyncio.get_event_loop().create_future()         fut.set_result(None)         self._task = fut      def post_task(self, awaitable):         async def run_awaitable(prev):             try:                 await prev                 await awaitable             except:                 pass  # consider at least logging here         self._task = asyncio.create_task(run_awaitable(self._task)) </code></pre>"
60407516	"\n problem when using javascript to exec ""python -c """	javascript|python	2020-02-26 05:46:56.877000 UTC	"<pre><code>function get_params(command_string,tpp){     var rt = ""None""     // 如果存在-&gt;那么取出值并覆盖     if(command_string.search(""-&gt;"") != -1){         rt = /-&gt;(.*):/.exec(command_string)[1]         var rep = /\)(\s{0,1}-&gt;\s{0,1}.*):/.exec(command_string)[1];         command_string = command_string.replace(rep, """");     }     command_string = command_string.replace(/(^\s*)/g, """");       var func_name = /^def ([_\da-zA-Z]+)\(.*/.exec(command_string)[1]      var comon = `python -c "" import inspect import json from typing import * from datetime import * result = [] ${command_string}     pass for x in inspect.signature(${func_name}).parameters.values():     try:         result.append(dict(name=x.name, annotation=x.annotation.__name__ if x.annotation != inspect._empty else 'Undeclared', default= x.default if x.default != inspect._empty else 'Undeclared'))      except Exception:         result.append(dict(name=x.name, annotation=x.annotation._name if x.annotation != inspect._empty else 'Undeclared', default= x.default if x.default != inspect._empty else 'Undeclared')) print(json.dumps(result)) ""`     console.log(comon)     var message = execute(comon).toString();     return {         ""params"":GenarateParamDoc(JSON.parse(message), tpp),         ""rt"": rt } } </code></pre>  <p>I try to use javascript to execute some python code by ""python -c"". it works in Linux,  but I don't know why failed in windows and mac, I guess it caused by the difference between \n \r\n  and \r.  </p>  <p>so I want to ask how to fix this problem.</p>  <p>this project is in <a href=""https://github.com/QUANTAXIS/QAHelper"" rel=""nofollow noreferrer"">https://github.com/QUANTAXIS/QAHelper</a></p>  <p>you can clone it and run in vscode.</p>"	
60439028	How to add a javascript and css file in Jinja2 using Databricks Python?	python|jinja2|databricks	2020-02-27 17:46:51.190000 UTC	"<p>I am using the Databricks Python notebook, and I am trying to render the HTML file in Jinja2.  I am trying to add a Javascript and CSS file. Below is the code I have written. </p>  <p>I am not creating any app using flask. it's just a simple template </p>  <pre><code>myTemplate = Template('''&lt;html&gt; &lt;center&gt;&lt;img src=""data:image/jpeg;base64,{{ tpath }}"" alt={{ name }} width=""1200"" height=""90"" /&gt;&lt;/center&gt;&lt;br&gt;&lt;h1&gt; Hello world {{ something }}!&lt;/h1&gt; {% block javascript %}     &lt;script type=""text/javascript""&gt;         {% include ""/mnt/sandbox/AWS-JDPS-MACHINE-HEALTH/Solution_PDF/myscript.js"" %}     &lt;/script&gt;     &lt;!-- The contents of myscript.js will be loaded inside the script tag --&gt; {% endblock %} {% block css %} &lt;link rel=""stylesheet"" type=""text/css"" href=""/mnt/sandbox/AWS-JDPS-MACHINE-HEALTH/Solution_PDF/Embed.css"" /&gt; {% endblock %}  &lt;/html&gt; ''') test = myTemplate.render(something=""MACHINE HEALTH"", tpath = file, name = 'Sample') </code></pre>  <p>Its throwing error ""No loader for this environment specified.""  As I am using Databricks environment and I am new to jinja2 and Databricks. I am not able to change the path of the environment. </p>  <p>Is there any other way to embed a CSS and javascript file in my template?<br> and when you render it - I would like an HTML file</p>  <p>BELOW IS THE COMPLETE ERROR - </p>  <pre><code>    TypeError                                 Traceback (most recent call last) &lt;command-11791890&gt; in &lt;module&gt;()      12 &lt;/html&gt;      13 ''') ---&gt; 14 test = myTemplate.render(something=""MACHINE HEALTH"", tpath = file, name = 'Tarun')  /databricks/python/lib/python3.5/site-packages/jinja2/environment.py in render(self, *args, **kwargs)     987         except Exception:     988             exc_info = sys.exc_info() --&gt; 989         return self.environment.handle_exception(exc_info, True)     990      991     def stream(self, *args, **kwargs):  /databricks/python/lib/python3.5/site-packages/jinja2/environment.py in handle_exception(self, exc_info, rendered, source_hint)     752             self.exception_handler(traceback)     753         exc_type, exc_value, tb = traceback.standard_exc_info --&gt; 754         reraise(exc_type, exc_value, tb)     755      756     def join_path(self, template, parent):  /databricks/python/lib/python3.5/site-packages/jinja2/_compat.py in reraise(tp, value, tb)      35     def reraise(tp, value, tb=None):      36         if value.__traceback__ is not tb: ---&gt; 37             raise value.with_traceback(tb)      38         raise value      39   &lt;template&gt; in top-level template code()  &lt;template&gt; in block ""javascript""()  TypeError: no loader for this environment specified </code></pre>"	"<p>There are two things here:</p> <ol> <li>Ninja doesn't know anything about Databricks File System (DBFS) that is really a wrapper around specific cloud storage implementation.  That's why it's complaining about missing loader.  To access files on DBFS from software that works with local files you need to prepend the <code>/dbfs</code> prefix to the path. For example: <code>/dbfs/mnt/sandbox/</code></li> <li>The same with stylesheets - you can't use <code>href=&quot;/mnt/sandbox/...</code>, as the file is not accessible.  The solution here is either include stylesheet as text into HTML, so the HTML is self contained.  Or put the file into the <a href=""https://docs.databricks.com/data/filestore.html#save-a-file-to-filestore"" rel=""nofollow noreferrer""><code>/FileStore</code> location on DBFS</a> (for example as <code>/FileStore/file_name.css</code>) and refer to it as <code>/files/file_name.css</code> (see documentation for more details/examples)</li> </ol>"
60518020	How to get variable value from Javascript using Selenium with Python	javascript|python|selenium|dom	2020-03-04 01:54:49.527000 UTC	"<p>Using Selenium, the following is the code I am running on Python to get my geo-coordinates via use of the navigator web api:</p>  <pre><code>        coordinates = driver.execute_script(         "" return () =&gt; {                                            "" +         ""   var savedCoordinates;                                   "" +         ""                                                           "" +         ""   navigator.geolocation.getCurrentPosition(               "" +         ""       (pos) =&gt; savedCoordinates = pos.coords,             "" +         ""       error,                                              "" +         ""       options);                                           "" +         ""                                                           "" +         ""   let options = {                                         "" +         ""       enableHighAccuracy: true,                           "" +         ""       timeout: 5000,                                      "" +         ""       maximumAge: 0                                       "" +         ""   };                                                      "" +         ""                                                           "" +         ""   function error(err) {                                   "" +         ""       console.warn(`ERROR(${err.code}): ${err.message}`); "" +         ""   };                                                      "" +         ""                                                           "" +         "" return savedCoordinates;                                  "" +         "" }                                                         "" )          print(coordinates)  </code></pre>  <p>Expected output: <code>{latitude: XXX.XXX, longitude XX.XXXX}</code></p>  <p>Actual output: <code>{}</code></p>  <p>Can someone help me figure out how I can get my geo-coordinates using this method?</p>"	"<p>It should work without <code>return () =&gt; { }</code></p>  <pre><code>    coordinates = driver.execute_script(     ""   var savedCoordinates;                                   "" +     ""                                                           "" +     ""   navigator.geolocation.getCurrentPosition(               "" +     ""       (pos) =&gt; savedCoordinates = pos.coords,             "" +     ""       error,                                              "" +     ""       options);                                           "" +     ""                                                           "" +     ""   let options = {                                         "" +     ""       enableHighAccuracy: true,                           "" +     ""       timeout: 5000,                                      "" +     ""       maximumAge: 0                                       "" +     ""   };                                                      "" +     ""                                                           "" +     ""   function error(err) {                                   "" +     ""       console.warn(`ERROR(${err.code}): ${err.message}`); "" +     ""   };                                                      "" +     ""                                                           "" +     "" return savedCoordinates;                                  "" )       print(coordinates) </code></pre>  <p>As for me this <code>() =&gt; {}</code> only defines function but it doesn't run it - so it returns this function, not result from function. You may need <code>()</code> to run it</p>  <pre><code>return (() =&gt; {...code...})() </code></pre>"
60521907	Can we pass a JavaScript variable to a Python file?	javascript|python|leaflet	2020-03-04 08:34:27.333000 UTC	"<p>I am developing a simple webpage GUI for my satellite images for a machine learning project. All the files are on my local machine and I intend to host the website locally as well. I have used plain Javascript and a third party library, Leaflet to display the image(kind of like a map). </p>  <p>The map displayed is basically a tiled version of image. I need to pass on the path of the tile (which I am currently storing in a js variable) to a python file which will use it to perform feature extraction of that particular tile.</p>  <p>Initially, I attempted to write it into a text file that the python program would read, but that displays a prompt everytime for downloading the file. Most of the other solutions involved FS module of NodeJS.</p>  <p>I am sorry if it is a very simple question I am a beginner and could not find any answer on the above (almost every answer uses some flavor of js)</p>"	"<p>If you need send data to python send JSON</p>  <p>Put it in your js and AJAX will be send to python script:</p>  <pre><code>$.ajax({         type: ""POST"",         url: $SCRIPT_ROOT + ""/my_data"",         data: ""data=Hello"",         success: function(response) {             console.log(jQuery.parseJSON(response).msg);         },         error: function (response) {             console.log(jQuery.parseJSON(response).msg);             alert(""Ajax error!"");         } }); </code></pre>  <p><br/>And then python will get request and send response:</p>  <pre class=""lang-py prettyprint-override""><code>@app.route('/my_data', methods=['GET', 'POST']) def ajax_data():     message = request.form['data']     print(message)     try:         return json.dumps({'msg': ""Message was successfully sent!""})     except Exception as e:         return json.dumps({'msg': ""Message send error : "" + e.message}) </code></pre>"
60521907	Can we pass a JavaScript variable to a Python file?	javascript|python|leaflet	2020-03-04 08:34:27.333000 UTC	"<p>I am developing a simple webpage GUI for my satellite images for a machine learning project. All the files are on my local machine and I intend to host the website locally as well. I have used plain Javascript and a third party library, Leaflet to display the image(kind of like a map). </p>  <p>The map displayed is basically a tiled version of image. I need to pass on the path of the tile (which I am currently storing in a js variable) to a python file which will use it to perform feature extraction of that particular tile.</p>  <p>Initially, I attempted to write it into a text file that the python program would read, but that displays a prompt everytime for downloading the file. Most of the other solutions involved FS module of NodeJS.</p>  <p>I am sorry if it is a very simple question I am a beginner and could not find any answer on the above (almost every answer uses some flavor of js)</p>"	"<p>Did you try using Flask micro web-framework ? It is the easiest way of integrating ML projects with web. </p>  <p>Check these videos if it helps </p>  <p><a href=""https://www.youtube.com/watch?v=CSEmUmkfb8Q&amp;t=154s"" rel=""nofollow noreferrer"">Deploying deep learning using flask for an image recogntion project</a></p>  <p><a href=""https://www.youtube.com/watch?v=UbCWoMf80PY&amp;t=1s"" rel=""nofollow noreferrer"">Deploy ML model using flask</a></p>"
60524402	Simple Algorithm From Javascript to Python code not producing same result	javascript|python|algorithm|encryption	2020-03-04 10:51:57.807000 UTC	"<p>I have this simple decrypt function in <strong>JavaScript</strong>:</p>  <pre><code>e.decrypt = function(t) {             var n, i = """", o = t.length, r = 0, s = 0;             for (r = 0; o &gt; r; r++) {                 for (n = t.substr(r, 1),                 s = 0; s &lt; e.MAP_LEN; s++) {                     if ("":"" == n &amp;&amp; "":|~"" == t.substr(r, 3)) {                         n = ""\n"",                         r += 2;                         break                     }                     if (n == e.charMap[s][1]) {                         n = e.charMap[s][0];                         break                     }                 }                 i += n             }             return i         }         ,         e.MAP_LEN = 64,         e.charMap = [[""A"", ""d""], [""B"", ""e""], [""C"", ""f""], [""D"", ""g""], [""E"", ""h""], [""F"", ""i""], [""G"", ""j""], [""H"", ""k""], [""I"", ""l""], [""J"", ""m""], [""K"", ""n""], [""L"", ""o""], [""M"", ""p""], [""N"", ""q""], [""O"", ""r""], [""P"", ""s""], [""Q"", ""t""], [""R"", ""u""], [""S"", ""v""], [""T"", ""w""], [""U"", ""x""], [""V"", ""y""], [""W"", ""z""], [""X"", ""a""], [""Y"", ""b""], [""Z"", ""c""], [""a"", ""Q""], [""b"", ""R""], [""c"", ""S""], [""d"", ""T""], [""e"", ""U""], [""f"", ""V""], [""g"", ""W""], [""h"", ""X""], [""i"", ""Y""], [""j"", ""Z""], [""k"", ""A""], [""l"", ""B""], [""m"", ""C""], [""n"", ""D""], [""o"", ""E""], [""p"", ""F""], [""q"", ""0""], [""r"", ""1""], [""s"", ""2""], [""t"", ""3""], [""u"", ""4""], [""v"", ""5""], [""w"", ""6""], [""x"", ""7""], [""y"", ""8""], [""z"", ""9""], [""0"", ""G""], [""1"", ""H""], [""2"", ""I""], [""3"", ""J""], [""4"", ""K""], [""5"", ""L""], [""6"", ""M""], [""7"", ""N""], [""8"", ""O""], [""9"", ""P""], [""\n"", "":|~""], [""\r"", """"]],         e </code></pre>  <p>Then, this is the <strong>Python</strong> version that I've made:</p>  <pre><code>def decryptToken(t):     n = """"     i = """"     o = len(t)     r = 0     s = 0     MAP_LEN = 64     charMap = [[""A"", ""d""], [""B"", ""e""], [""C"", ""f""], [""D"", ""g""], [""E"", ""h""], [""F"", ""i""], [""G"", ""j""], [""H"", ""k""], [""I"", ""l""], [""J"", ""m""], [""K"", ""n""], [""L"", ""o""], [""M"", ""p""], [""N"", ""q""], [""O"", ""r""], [""P"", ""s""], [""Q"", ""t""], [""R"", ""u""], [""S"", ""v""], [""T"", ""w""], [""U"", ""x""], [""V"", ""y""], [""W"", ""z""], [""X"", ""a""], [""Y"", ""b""], [""Z"", ""c""], [""a"", ""Q""], [""b"", ""R""], [""c"", ""S""], [""d"", ""T""], [""e"", ""U""], [""f"", ""V""], [""g"", ""W""], [""h"", ""X""], [""i"", ""Y""], [""j"", ""Z""], [""k"", ""A""], [""l"", ""B""], [""m"", ""C""], [""n"", ""D""], [""o"", ""E""], [""p"", ""F""], [""q"", ""0""], [""r"", ""1""], [""s"", ""2""], [""t"", ""3""], [""u"", ""4""], [""v"", ""5""], [""w"", ""6""], [""x"", ""7""], [""y"", ""8""], [""z"", ""9""], [""0"", ""G""], [""1"", ""H""], [""2"", ""I""], [""3"", ""J""], [""4"", ""K""], [""5"", ""L""], [""6"", ""M""], [""7"", ""N""], [""8"", ""O""], [""9"", ""P""], [""\n"", "":|~""], [""\r"", """"]]      for r in range (0,o):         for s in range(0,MAP_LEN):             n = t[r:1]             if "":"" == n and "":|~"" == t[r:3]:                 n = ""\n""                 r = r + 2                 break             if n == charMap[s][1]:                 n = charMap[s][0]                 break         i=i+n     return i </code></pre>  <p>If you test with this token <code>PEqVaW==.VdDjVbbgQU6y3fBGWfn7UDKmOXFUsLK9e5byiPSULUd=</code> with the <strong>Javascript</strong> version, you should get this <strong>result</strong>:</p>  <blockquote>   <p>9oNfXg==.fAnGfYYDaewVtCl0gCKxen4J8hpeP54zBvYVF9ce5eA=</p> </blockquote>  <p>But in <strong>Python</strong> this the output:</p>  <blockquote>   <p>9</p> </blockquote>  <p>What am I doing wrong?</p>"	
60528792	How to combine javascript/react frontend and python backend?	python|reactjs|frontend|backend	2020-03-04 14:54:37.130000 UTC	"<p><br> I'm not quite sure if my question is a duplicate, but I wasn't able to find something helping me in my case.  <br><br><strong>Set Up</strong><br> I've built a frontend webpage which contains a couple of services, for example show some timeseries and other information about my system. The website is build with the react framework and so using javascript in general. <br> Now I want to do some calculations about the timeseries for example calculate the similarity and other features of my sensordata. For that I'm using python which offers me a lot of libraries I've used for a long time and are easy to use.<br><br><br><strong>What I'm looking for:</strong> <br>I'm looking for a very simple way to call my backend-timeseries-analysis-python script from the react GUI passing some variables like the length of the series. Also I want to process the returned values and safe the current values needed for normalization (like max,min) for further calculations. <br><br> So the procedure would look like the following:<br></p>  <pre><code>1) Type value in react frontend input box 2) react/javascript calls pythonscript/ initialize a class and passes variables to class 3) python calculates similarity of sensor data  4) python returns similarity values to frontend and saves classes for later call 5) react displays returned values 6) react/javascript calls pythonscript 7) python compares latest data to past data and refreshs treshholds(like max, min) 8) python calculates similarity of sensor data  9) continue..  </code></pre>  <p>Thanks for your help! </p>  <p><a href=""https://i.stack.imgur.com/mPamU.png"" rel=""noreferrer""><img src=""https://i.stack.imgur.com/mPamU.png"" alt=""System set up""></a></p>"	"<p>You can expose your Python scripts on a REST API which will be called by your React frontend. Database connection will be made by this API, and the response is sent to your frontend.</p>  <p>See <a href=""https://flask.palletsprojects.com/en/1.1.x/"" rel=""noreferrer"">Flask</a> (very simple for small projects) or even <a href=""https://www.djangoproject.com/"" rel=""noreferrer"">Django</a> to build Python APIs.</p>"
