12052844	Extract translator comments with xgettext from JavaScript (in Python mode)	javascript|python|gettext|xgettext	2012-08-21 10:21:00.823000 UTC	"<p>I have a pretty well-working command that extracts strings from all my .js and .html files (which are just Underscore templates). However, it doesn't seem to work for Translator comments.</p>  <p>For example, I have this in one of my .js files:</p>  <pre><code>/// TRANSLATORS: The word ""manual"" stands for manual process gettext(""manual""); </code></pre>  <p>Using the following command:</p>  <pre><code>find . -iname '*.html' -o -iname '*.js' | xargs xgettext --language=Python --from-code=utf-8 --keyword=pgettext:1c,2 --keyword=npgettext:1c,2,3 --add-comments=/  </code></pre>  <p>xgettext should extract the comment from the .js file and put it into my .po file like this:   </p>  <pre><code>#. TRANSLATORS: The word ""manual"" stands for manual process #: tax.js:200  msgid ""manual""     msgstr """"  </code></pre>  <p>But it doesn't. Am I doing something wrong here or are translator comments just not working in Python mode? </p>  <p><strong>EDIT:</strong> I have accepted John Flatness' answer as the correct one, however <strong>I did find a workaround</strong> that enables me to still use the Python mode and extract translator comments. It's not perfect, because it actually leaves some of the syntax inside the comments:</p>  <p>In my <code>tax.js</code> file:</p>  <pre><code>/* # This is a translator comment */ gettext(""What is this?""); </code></pre>  <p>Run this command:</p>  <pre><code>find . -iname '*.html' -o -iname '*.js' | xargs xgettext --language=Python --from-code=utf-8 --keyword=pgettext:1c,2 --keyword=npgettext:1c,2,3 -c </code></pre>  <p>Result in .po file:</p>  <pre><code>#. This is a translator comment */ #: tax.js:201 msgid ""What is this?"" msgstr """" </code></pre>  <p>As You can see, the only problems are that:</p>  <ol> <li>I have to write the comment in 2 lines</li> <li>The comment terminator <code>*/</code> is left in the translator comments</li> </ol>  <p>This should not be much of an issue in most cases, though.</p>"	12061639	"<p>The problem is that you're telling <code>xgettext</code> that the source is Python, when it's really JavaScript.</p>  <p>This may make it work ""well enough"" for many cases, but I'd assume what's tripping things up here is that Python doesn't do one-liner comments with <code>//</code>, it uses <code>#</code>.</p>  <p>There's a <a href=""https://github.com/AndyStricker/gettext-javascript"" rel=""noreferrer"">project on Github</a> that adds javascript support to the gettext tools. I'm not sure of its current status, and you'd have to build from source to use it. Otherwise, I suppose you could try other languages that <code>xgettext</code> does support that have more C/C++/Java-like syntax.</p>"
12052844	Extract translator comments with xgettext from JavaScript (in Python mode)	javascript|python|gettext|xgettext	2012-08-21 10:21:00.823000 UTC	"<p>I have a pretty well-working command that extracts strings from all my .js and .html files (which are just Underscore templates). However, it doesn't seem to work for Translator comments.</p>  <p>For example, I have this in one of my .js files:</p>  <pre><code>/// TRANSLATORS: The word ""manual"" stands for manual process gettext(""manual""); </code></pre>  <p>Using the following command:</p>  <pre><code>find . -iname '*.html' -o -iname '*.js' | xargs xgettext --language=Python --from-code=utf-8 --keyword=pgettext:1c,2 --keyword=npgettext:1c,2,3 --add-comments=/  </code></pre>  <p>xgettext should extract the comment from the .js file and put it into my .po file like this:   </p>  <pre><code>#. TRANSLATORS: The word ""manual"" stands for manual process #: tax.js:200  msgid ""manual""     msgstr """"  </code></pre>  <p>But it doesn't. Am I doing something wrong here or are translator comments just not working in Python mode? </p>  <p><strong>EDIT:</strong> I have accepted John Flatness' answer as the correct one, however <strong>I did find a workaround</strong> that enables me to still use the Python mode and extract translator comments. It's not perfect, because it actually leaves some of the syntax inside the comments:</p>  <p>In my <code>tax.js</code> file:</p>  <pre><code>/* # This is a translator comment */ gettext(""What is this?""); </code></pre>  <p>Run this command:</p>  <pre><code>find . -iname '*.html' -o -iname '*.js' | xargs xgettext --language=Python --from-code=utf-8 --keyword=pgettext:1c,2 --keyword=npgettext:1c,2,3 -c </code></pre>  <p>Result in .po file:</p>  <pre><code>#. This is a translator comment */ #: tax.js:201 msgid ""What is this?"" msgstr """" </code></pre>  <p>As You can see, the only problems are that:</p>  <ol> <li>I have to write the comment in 2 lines</li> <li>The comment terminator <code>*/</code> is left in the translator comments</li> </ol>  <p>This should not be much of an issue in most cases, though.</p>"	30515371	"<p>The way to get the ""translator comment"" without any pollution, is to add a hash <code>#</code> after the javascript comment start <code>//</code>, this way xgettext will interpret everything after it as a normal Python comment.</p>  <p>Try this:</p>  <pre><code>//# This is a translation comment console.log(_('Some String')); </code></pre>  <p>And extract with xtext like:</p>  <pre><code>xgettext --language=Python --from-code=utf-8 --force-po -c -o file.po file.js </code></pre>  <p>This will create the PO as follows:</p>  <pre><code>#. This is a translation comment #: /path/to/file.js:2 msgid ""Some String"" msgstr """" </code></pre>  <p>I successfully did this using gettext 0.18.1.1-5ubuntu3 on Ubuntu 12.04.4</p>"
12089722	Values get converted to UNICODE when sent by Python in Javascript	javascript|python|django	2012-08-23 10:35:41.657000 UTC	"<p>I have a small problem when my code is retrieved by javaScript from Python, i get unicode values to my script where my browser gives an error in the developer console.</p>  <p>The script inside my archive.html page - </p>  <pre><code>&lt;script&gt;     var results = {{myposts}};     console.log(results); &lt;/script&gt; </code></pre>  <p>My Python code -</p>  <pre><code>def archive(request):     test = [""a"",""b"",""c""]     t = loader.get_template(""archive.html"")     c = Context({'myposts' : test})     return HttpResponse(t.render(c)) </code></pre>  <p>I tried <code>c = Context({'myposts' : simplejson.dumps(test)})</code> , but it gave the problem. My browsers give me and arror <strong>Uncaught SyntaxError: Unexpected token &amp;</strong> and my console shows my array with unicode values <code>[&amp;#39;a&amp;#39;, &amp;#39;b&amp;#39;, &amp;#39;c&amp;#39;]</code></p>  <p>How do i make it look like - <code>[""a"",""b"",""c""]</code></p>  <p>What do i change in my Python code or JavaScript </p>  <p>Thanks for the help in advance</p>"	12089800	"<p>Try this in the template:</p>  <pre><code>&lt;script&gt;     var results = {{ myposts|escapejs }};     console.log(results); &lt;/script&gt; </code></pre>  <p>EDIT:</p>  <p>And in the view:</p>  <pre><code>from django.utils import simplejson  def archive(request):     test = [""a"",""b"",""c""]     t = loader.get_template(""archive.html"")     c = Context(simplejson.dumps({'myposts' : test}))     return HttpResponse(t.render(c)) </code></pre>"
12089722	Values get converted to UNICODE when sent by Python in Javascript	javascript|python|django	2012-08-23 10:35:41.657000 UTC	"<p>I have a small problem when my code is retrieved by javaScript from Python, i get unicode values to my script where my browser gives an error in the developer console.</p>  <p>The script inside my archive.html page - </p>  <pre><code>&lt;script&gt;     var results = {{myposts}};     console.log(results); &lt;/script&gt; </code></pre>  <p>My Python code -</p>  <pre><code>def archive(request):     test = [""a"",""b"",""c""]     t = loader.get_template(""archive.html"")     c = Context({'myposts' : test})     return HttpResponse(t.render(c)) </code></pre>  <p>I tried <code>c = Context({'myposts' : simplejson.dumps(test)})</code> , but it gave the problem. My browsers give me and arror <strong>Uncaught SyntaxError: Unexpected token &amp;</strong> and my console shows my array with unicode values <code>[&amp;#39;a&amp;#39;, &amp;#39;b&amp;#39;, &amp;#39;c&amp;#39;]</code></p>  <p>How do i make it look like - <code>[""a"",""b"",""c""]</code></p>  <p>What do i change in my Python code or JavaScript </p>  <p>Thanks for the help in advance</p>"	12090218	<p>Looks like it's getting HTML-escaped on output. What if you do this?:</p>  <pre><code>var results = {{ myposts|safe }}; </code></pre>  <p>(Use with caution -- you may want to perform some escaping depending where the data is coming from.)</p>
12184404	javascript interactive debugging (equivalent of python's pdb.set_trace())	javascript|debugging|interactive	2012-08-29 18:37:31.883000 UTC	"<p>I'm working with some javascript code and I'd love to be able to get an interactive console running in the context of a function call - that is, basically exactly what python's <code>import pdb; pdb.set_trace()</code> accomplishes. Is there any way to do this? If not, what's the best approximation out there? </p>  <p>I'm currently using Chrome's console to mess around with things, and I'd basically love to be dropped into the middle of a function call and use Chrome's console to poke around the local variables and such.</p>"	12184478	"<p>Set a breakpoint, and Chrome's Inspector will allow you to inspect your app's state.</p>  <ul> <li><p>Click the line number.  A blue marker will appear.  Execution will pause when you hit that line. <img src=""https://i.stack.imgur.com/jh4Oo.png"" alt=""Breakpoint set""></p></li> <li><p>Write a <code>debugger</code> statement in your code.  The Inspector will pause when you hit the statement.</p>  <pre><code>function something() {     // do stuff     debugger; } </code></pre></li> </ul>"
12184404	javascript interactive debugging (equivalent of python's pdb.set_trace())	javascript|debugging|interactive	2012-08-29 18:37:31.883000 UTC	"<p>I'm working with some javascript code and I'd love to be able to get an interactive console running in the context of a function call - that is, basically exactly what python's <code>import pdb; pdb.set_trace()</code> accomplishes. Is there any way to do this? If not, what's the best approximation out there? </p>  <p>I'm currently using Chrome's console to mess around with things, and I'd basically love to be dropped into the middle of a function call and use Chrome's console to poke around the local variables and such.</p>"	12184485	<p>You can set breakpoints in chrome developers tool as well as firebug in firefox and developer tool in ie 8 and above..</p>
12228439	"can a javascript ""alert"" be written in python"	python|http|alert	2012-09-01 14:08:09.857000 UTC	"<p>This question is really a follow on to <a href=""https://stackoverflow.com/questions/11835306/404-error-passing-a-alert-sentence-from-python-to-html-page-but-no-error-for"">this question</a></p>  <p>In python how can I make an html alert template know where it came from so it will return there, without making a different template for each exception?</p>  <hr>  <p>I was thinking too much about the javascript ""alert"" which initiates in the html template, not in the python code. My ""alert"" starts in the python code itself, so I can just pass a ""hidden"" variable value to the template which tells where to return and capture that ""hidden"" value with the ""def post"" part of the python code. </p>  <p>No, this is still not quite complete. Do I have to import and use that urllib stuff, also?</p>"	12228453	"<p>It's not remotely bulletproof, but checking the <a href=""http://en.wikipedia.org/wiki/HTTP_referer"" rel=""nofollow"">HTTP <code>Referer</code> header</a> sounds sufficient for your needs. If you want more control over the return URL, you can simply pass it around a query parameter instead. Just make sure to <a href=""http://docs.python.org/library/urllib.html#urllib.quote"" rel=""nofollow"">percent-encode it</a>.</p>"
12359019	"Convert a RDF to SVG, in python or javascript?"	python|svg|rdf	2012-09-10 20:33:50.513000 UTC	"<p>Does anyone have code which convert a RDF into a SVG, ideally in python or javascript. </p>"	12359187	"<p>Possibly the libraries rdflib and pysvg could be of use for your work.</p>  <p><a href=""http://codeboje.de/pysvg/"" rel=""nofollow"">http://codeboje.de/pysvg/</a></p>  <p><a href=""http://code.google.com/p/rdflib/"" rel=""nofollow"">http://code.google.com/p/rdflib/</a></p>"
12468131	How to send email in javascript or python from specific email account?	javascript|python|email	2012-09-17 22:49:40.267000 UTC	<p>I have an html file on my computer that takes an email address (gmail) and a password as input. I want to use javascript or python to log into the gmail acount with the given email address and send a message to another email address. How would I do this? Either javascript or python is fine.</p>	12468178	"<p><a href=""https://developers.google.com/google-apps/gmail/"" rel=""nofollow noreferrer"">From Google</a>: </p>  <blockquote>   <p>""Gmail supports the standard IMAP and SMTP protocols for accessing and   sending e-mail messages. The Gmail IMAP and SMTP servers have been   extended to support authorization via the industry-standard OAuth 2.0   protocol.""</p> </blockquote>  <p>So it looks like with an  OAuth STMP/IMAP Javascript library you should be able to make this work.  See this SO article for an example: <a href=""https://stackoverflow.com/q/9795794/573083"">Connecting to the Gmail IMAP API in javascript/node.js</a></p>  <p>Another option is to take a look at the <a href=""http://www.jamesyu.org/2011/02/05/introducing-gmailr-an-unofficial-javscript-api-for-gmail/"" rel=""nofollow noreferrer"">Gmailr API</a>.  </p>  <p>While this is not going to be a plug-and-play solution for you, it's the course that most of the early 3rd party gmail extenders apparently used.   </p>"
12481767	Javascript and Spynner (Python)	javascript|python|screen-scraping|spynner	2012-09-18 17:07:51.637000 UTC	"<p>I'm trying to scrape a website and do I need to use Javascript. I am using Python 2.7 and Spynner. This is the script:</p>  <pre><code>   &lt;a href=""javascript://"" onclick=""TranslationPopUpTestimonialQuery('Language_ALL', '',       '5', '10', 'date-of-visit')""&gt;6&lt;/a&gt; </code></pre>  <p>This is my code in Python:</p>  <pre><code>   import spynner    browser = spynner.Browser()    browser.load(""http://www.zoover.it/italia/lazio/roma/galileo/hotel"")    page1 = browser._get_html()    browser.runjs(""TranslationPopUpTestimonialQuery('Language_ALL', '', '8', '10', 'date-of-visit')"")    browser.wait_load()    page2 = browser._get_html() </code></pre>  <p>Something does not work as get_html does not give me the desired html page...</p>  <p>This the first url: <a href=""http://www.zoover.it/italia/lazio/roma/galileo/hotel"" rel=""nofollow"">http://www.zoover.it/italia/lazio/roma/galileo/hotel</a>. I load this page with browser.load() and i get the HTML. After i try to go to page 2 simulating a click with browser.runjs(). I call the javascript on the onClick. Then If i call browser._get_html() another time the HTML is ever the same. Can anyone help me? thanks</p>"	12766533	"<p>It the html you want is in a popup, you ll have to switch spynner frames.</p>  <p>What spynner gives you is always the active frame html, popups open in another frames.</p>  <p>Spynner is an interface to qtwebwekit and qtwebkit use that : <a href=""http://doc.qt.digia.com/4.7-snapshot/qwebframe.html"" rel=""nofollow"">http://doc.qt.digia.com/4.7-snapshot/qwebframe.html</a></p>  <p>You can see that there is ""childframes"", that you can introspect with self.webframe.</p>"
12498694	Javascript-Python: serve dynamically generated images to client browser?	php|javascript|python	2012-09-19 16:11:08.860000 UTC	"<p>Scenario: User loads a page, image is being generated, show loading bar, notification event sent to browser.</p>  <p>I am using python code to generate the image. Would it be ideal to have a web server that launches the script or embed a webserver code into the python script? Once the image is finished rendering, the client should receive a message saying it's successful and display the image.</p>  <p>How can this be architected to support concurrent users as well? Would simply launching the python script for each new user that navigates to the web page suffice?</p>  <p>Would it be overkill to have real-time web application for this scenario?  Trying to decide whether simple jQuery AJAX will suffice or Socket.io should be used to have a persistent connection between server and client.</p>  <p>Any libraries out there that fit my needs? </p>"	12498821	"<p>I personally love Socket.IO and I would to it with it. Because it would be simpler a way. But that may be a bit too much work to set up just for that. Especially since it is not that simple in Python from what I heard compare to node where it really is about 10 lines server side.</p>  <p>Without Socket.IO could do a long polling to get the status of the image processing, and get the url at the end, of the image in base64 if that is what you want.</p>"
12498694	Javascript-Python: serve dynamically generated images to client browser?	php|javascript|python	2012-09-19 16:11:08.860000 UTC	"<p>Scenario: User loads a page, image is being generated, show loading bar, notification event sent to browser.</p>  <p>I am using python code to generate the image. Would it be ideal to have a web server that launches the script or embed a webserver code into the python script? Once the image is finished rendering, the client should receive a message saying it's successful and display the image.</p>  <p>How can this be architected to support concurrent users as well? Would simply launching the python script for each new user that navigates to the web page suffice?</p>  <p>Would it be overkill to have real-time web application for this scenario?  Trying to decide whether simple jQuery AJAX will suffice or Socket.io should be used to have a persistent connection between server and client.</p>  <p>Any libraries out there that fit my needs? </p>"	12498955	"<p>I would recommend not spawning a new child for every request, but rather using some task queue management tool, for example I can reccomend <a href=""http://celeryproject.org/"" rel=""nofollow"">celery</a>. </p>  <p>You could for example run a threaded python webserver which would spawn one task for each request. Each client could then ask periodically (javascript/jquery) if the task is finished, and if so, server would return proper image address. Also, celery has <a href=""http://docs.celeryproject.org/en/latest/userguide/remote-tasks.html"" rel=""nofollow"">web-callbacks</a> which could be used in this case. (I think, I have not used this feature myself).</p>  <p>I would not lose time with writing some ad-hoc solution, since this is simple, easy to deploy, well documented and scales very well.</p>"
12648299	Running Javascript in python 3.2	javascript|python-3.x	2012-09-28 22:44:28.797000 UTC	"<p>I am trying to create a python program that can log into a website. I have written the javascript that can log in; however, I haven't seen anything on running javascript in python. I am considering implementing the firefox javascript engine, seamonkey, but also don't know how to do that in python. </p>  <p>Any help would be wonderful. Thank you!</p>"	12651570	"<p>Mixing <em>Python</em> with <em>JavaScript</em>, if at all possible, will be probably difficult and in my opinion not the ideal approach.</p>  <p>For a pure <em>Python</em> solution I suggest <a href=""http://pypi.python.org/pypi/mechanize/0.2.5"" rel=""nofollow"">mechanize</a>.</p>  <p>For a <em>JavaScript</em>-only solution, <a href=""http://phantomjs.org/"" rel=""nofollow"">PhantomJS</a> seems to be a very interesting framework. </p>"
12649849	Invoke Webkit Javascript Functions from Python Cleanly	javascript|python|qt|webkit|pyqt	2012-09-29 04:14:24.737000 UTC	"<p>For an application I am currently working on I decided to use HTML5 for the interface, allowing me to have a modern interface that doesn't change in appearance when you change operating systems. Naturally I chose the webkit engine for rendering, specifically the PyQT bindings. My issue is that every time I want to call a javascript function from python, I have to do it using the messy evaluateJavaScript function.</p>  <p>Any alternatives I can use that allow a more direct way of calling javascript functions?</p>"	12649953	"<p>PyQt doesn't have any wrapper that makes things easier.</p>  <p>You could write your own, if you want—not perfect, but a little nicer. For example, something like this (just a skeleton, not actual code):</p>  <pre><code>class JSObject(object):     def __init__(self, name):         self.name = name     def __getattr__(self, attr):         class Proxy(object):             def __init__(self, objname, funcname):                 self.name = '%s.%s' % (objname, funcname)             def __call__(self, *args):                 argstr = ', '.join(json.dumps(arg) for arg in args)                 retstr = evaluateJavaScript('%s(%s)' % (self.name, argstr)                 # realistically you may want to do more to parse the return                 # value—e.g., look up/create JSONObjects as needed?                 return json.loads(retstr)         return Proxy(self, attr)  thingIWantToCall = JSObject('thingIWantToCall') print thingIWantToCall.methodIWantToCallOnIt('foo', [1, 2, 3]) </code></pre>  <p>As you can see, it's still a bit clumsy—you have to manually create the object proxies, and there's no way to call free functions or declare variables or anything other than call methods on objects. Some of that could be implemented, but there's a limit to how far you can go. (Of course you can always fall back to explicit strings.)</p>"
12652695	Python 3 + Javascript	javascript|python|html	2012-09-29 12:27:09.960000 UTC	"<p>I downloaded one html-page. I need to parse one string form page, but it's behind javascripts. When i run this page in browser - all looks pretty, but in html-code i see something like this:</p>  <pre><code>&lt;script type=""text/javascript""&gt;function deobfuscate_html(){s007=null;s7125=6 ... #long long string </code></pre>  <p>How can I unpack this? I want to see the pretty raw, like in browser.</p>"	12652747	"<p>I would run the page in a web browser using Selenium (triggered and controlled in Python) - you can then gain access to the fully rendered page.</p>  <p>The chosen answer <a href=""https://stackoverflow.com/questions/1816232/how-to-get-the-html-source-of-a-specific-element-with-selenium"">here</a> will show you how to get the html from a rendered page.</p>"
12731336	Javascript compression in memory. Decompress in Python after Post. Must also handle non-ascii	javascript|python|compression	2012-10-04 16:07:48.860000 UTC	"<p>I need to be able to compress a string in Javascript, but without saving a temporary file. I am then going to send this compressed data via a POST. I will receive it in Python so I need to be able to decompress it there. I implemented the following, <a href=""http://rosettacode.org/wiki/LZW_compression"" rel=""nofollow"">http://rosettacode.org/wiki/LZW_compression</a>, only to discover that it only works on ascii-characters. I am going to be reading webpages and never know what characters I'll be getting. </p>  <p>(The reason I need to do this is because the strings can become quite long and therefore take too long for slow networks to post.) </p>"	12731546	"<p>You can try base64-encoding the string beforehand (this will yield a compressed stream from 1.5 to twice the size it would have if it had been possible to compress it directly).</p>  <p>There is another implementation (this of gzip Deflate algorithm) <a href=""https://github.com/dankogai/js-deflate"" rel=""nofollow"">here</a>.</p>  <p>Or you might try and escape the non-ASCII characters by replacing them with \xNN (NN = hex code of character). Of course you will also have to escape the slash .</p>  <p>Anyway, you are unlikely to achieve more than about a 10X increase in speed, and I fear this would be more than balanced by the encoding overhead. Without knowing more about the use case, I'd suggest going with Deflate.</p>"
12731336	Javascript compression in memory. Decompress in Python after Post. Must also handle non-ascii	javascript|python|compression	2012-10-04 16:07:48.860000 UTC	"<p>I need to be able to compress a string in Javascript, but without saving a temporary file. I am then going to send this compressed data via a POST. I will receive it in Python so I need to be able to decompress it there. I implemented the following, <a href=""http://rosettacode.org/wiki/LZW_compression"" rel=""nofollow"">http://rosettacode.org/wiki/LZW_compression</a>, only to discover that it only works on ascii-characters. I am going to be reading webpages and never know what characters I'll be getting. </p>  <p>(The reason I need to do this is because the strings can become quite long and therefore take too long for slow networks to post.) </p>"	12731553	"<p>From OP comment.</p>  <blockquote>   <p>The javascript reads the DOM elements and sends that. It won't work to   point to the source for various reasons, a main one being that I need   the elements created by javascript on the page. I also need the   computed style that the browser calculates for me.</p> </blockquote>  <p>One solution would be to automate a browser using <a href=""http://seleniumhq.org/"" rel=""nofollow"">Selenium</a> with Python and then retrieve the DOM from that.</p>"
