62385261	Interpret Javascript web application using Python	javascript|python	2020-06-15 09:30:00.697000 UTC	"<p>Excuse me if my coding lingo is off, I'm familiar with coding but still what you might consider a beginner. Let me first explain why I'm doing this, followed by what I what I want from it to hopefully give you an idea of how to tackle this problem. </p>  <p>I'm a small streamer on dlive, to reward my viewers for watching I'm using a service called Incent, that rewards viewers with crypto for picking up dropcodes. I've noticed that people have a better experience when someone has typed out the code in the chat rather than it blinking on screen for 30 seconds only to disappear. It's not always someone sits in chat and types it out and sometimes there are spelling errors etc. I figured I wanted to automate  the process to make the integration of incent into my stream more seamless. I've coded my own chat bot using python and just wanted to push the code through that.The bot is working and able to send messages, so that's not my issue here. </p>  <p>Now the issue I have is how do I make python interpret what's happening on the drop url, making it take just the drop code. The incent drop url uses javascript so I'm not entirely sure how to make it work. Here's a url to the preview, so you can get an idea what happens when a drop comes <a href=""https://get.incent.com/overlays/v1/dropcodes/28mIAiGQNa7adlZAg6948N:15LCP76AiNGk6RmRAaKKep?preview"" rel=""nofollow noreferrer"">https://get.incent.com/overlays/v1/dropcodes/28mIAiGQNa7adlZAg6948N:15LCP76AiNGk6RmRAaKKep?preview</a></p>  <p>I'm not sure what route to go from here. I was playing around the idea with web scraping, but I'd rather it run in the background and not having to open up, say a selenium browser every time it needs to check for the code. A method like that I imagine would have to run continuously inside a while loop. Ideally I'd want python to just receive the code every time it drops. I thought I could use requests to accomplish this, but I have to admit that I don't know how to make that work. </p>  <p>Hopefully you now have an idea of what the problem is and I hope you can help me with this.  </p>"	"<p>You could try something like this.</p>  <ul> <li>Open the page via headless browser</li> <li>wait until the code arrives (an element with <code>class^=""RewardCodestyles__Code""]</code> - meaning that starts with that class)</li> <li>evaluate the <code>innertText</code> or <code>textContent</code> of that element to retrieve the code</li> <li>sleep for some time (10 sec in this example) and start over</li> </ul>  <p>Sample code (with <a href=""https://pypi.org/project/pyppeteer/"" rel=""nofollow noreferrer"">pyppeteer</a>):</p>  <pre><code>import asyncio from pyppeteer import launch  URL = 'https://get.incent.com/overlays/v1/dropcodes/28mIAiGQNa7adlZAg6948N:15LCP76AiNGk6RmRAaKKep?preview'   async def main():     browser = await launch()     page = await browser.newPage()     await page.goto(URL)      # wait until the code arrives     await page.waitForFunction('''() =&gt; {         return !!document.body.querySelector('[class^=""RewardCodestyles__Code""]')     }     ''', {         'timeout': 60000     })      # then just extract the code     code = await page.evaluate('''() =&gt; {         return document.body.querySelector('[class^=""RewardCodestyles__Code""]').innerText     }''')      # do things with the code here     print(code)      await browser.close()   async def forever():     while True:         await main()         # sleep a bit here - for 10 secs.         await asyncio.sleep(10)  loop = asyncio.get_event_loop() loop.run_until_complete(forever()) </code></pre>  <p>An output from a sample run:</p>  <pre><code>TEST-C0D3 TEST-C0D3 TEST-C0D3 TEST-C0D3 TEST-C0D3 TEST-C0D3 </code></pre>"
62404345	Javascript HMAC and Python HMAC not returning same hash	javascript|python|hmac	2020-06-16 08:36:58.573000 UTC	"<p>I currently have a Javascript code that looks like this</p>  <pre><code>var CryptoJS = require(""crypto-js"");  var key = ""bookbookbook""; var msg = ""2020-06-16 20:03:19"";  var signature = CryptoJS.HmacSHA1(msg, key); var checksum = CryptoJS.enc.Utf8.parse(signature);  console.log(""checksum: "" + CryptoJS.enc.Base64.stringify(checksum)); </code></pre>  <p>the checksum is ODNjOWY5NThmYzUxODNkYWM1MjhjZTY3ZTYzYmQxNjE1ZDRkZDQ5Zg==</p>  <p>I tried to convert it to Python</p>  <pre><code>import base64 import time import hmac import hashlib  key = ""bookbookbook"".encode(encoding='utf-8') msg = ""2020-06-16 20:03:19"".encode(encoding='utf-8')  digest = hmac.new(key, msg, hashlib.sha1).digest() checksum = base64.b64encode(digest).decode('utf-8')  print(checksum) </code></pre>  <p>but the checksum returned is this g8n5WPxRg9rFKM5n5jvRYV1N1J8=</p>  <p>How do I make it return the same?</p>"	"<p>I found the solution. Although I do agree with Kaddath the Javascript sucks, I'm unable to alter it due to the fact that  1) it has been been used and running for several years and  2) I'm doing a port to Python, not fixing/updating the original code and 3) ""da bossman"" says just port not fix</p>  <p>Here's the Python code that produces the same output:</p>  <pre><code>import base64 import time import hmac import hashlib import binascii  key = ""bookbookbook"".encode(encoding='utf-8') msg = ""2020-06-16 20:03:19"".encode(encoding='utf-8')  digest = hmac.new(key, msg, hashlib.sha1).digest()  checksum = base64.b64encode(binascii.hexlify(bytearray(digest))) print(""checksum: "", checksum.decode('utf-8')) </code></pre>"
62404345	Javascript HMAC and Python HMAC not returning same hash	javascript|python|hmac	2020-06-16 08:36:58.573000 UTC	"<p>I currently have a Javascript code that looks like this</p>  <pre><code>var CryptoJS = require(""crypto-js"");  var key = ""bookbookbook""; var msg = ""2020-06-16 20:03:19"";  var signature = CryptoJS.HmacSHA1(msg, key); var checksum = CryptoJS.enc.Utf8.parse(signature);  console.log(""checksum: "" + CryptoJS.enc.Base64.stringify(checksum)); </code></pre>  <p>the checksum is ODNjOWY5NThmYzUxODNkYWM1MjhjZTY3ZTYzYmQxNjE1ZDRkZDQ5Zg==</p>  <p>I tried to convert it to Python</p>  <pre><code>import base64 import time import hmac import hashlib  key = ""bookbookbook"".encode(encoding='utf-8') msg = ""2020-06-16 20:03:19"".encode(encoding='utf-8')  digest = hmac.new(key, msg, hashlib.sha1).digest() checksum = base64.b64encode(digest).decode('utf-8')  print(checksum) </code></pre>  <p>but the checksum returned is this g8n5WPxRg9rFKM5n5jvRYV1N1J8=</p>  <p>How do I make it return the same?</p>"	"<p>this step is unnecessary and transforms your data, making the result wrong: <code>var checksum = CryptoJS.enc.Utf8.parse(signature);</code> (<code>Utf8.parse</code> is used to convert an UTF-8 string to wordsArray, but you already have a wordsArray as a result from <code>CryptoJS.HmacSHA1</code>'s call)</p>  <p>Your code should be: (took responsability to change variables names to something more proper)</p>  <pre><code>var CryptoJS = require(""crypto-js"");  var key = ""bookbookbook""; var msg = ""2020-06-16 20:03:19"";  var encrypted = CryptoJS.HmacSHA1(msg, key);  console.log(""encrypted in Base64: "" + CryptoJS.enc.Base64.stringify(encrypted)); </code></pre>  <p><a href=""https://jsfiddle.net/q758dwL0/"" rel=""nofollow noreferrer"">see it in action in a fiddle, you'll see same result as the python code</a></p>"
62431352	Are JavaScript object literals the same thing as Python dictionaries?	javascript|python|dictionary|object-literal	2020-06-17 14:26:34.273000 UTC	<p>I’ve started using JavaScript recently and have noticed a resemblance between JavaScript object literals and python dictionaries. They are used in similar situations and have similar syntax. So are they basically the same thing but with different names?</p>	"<p>it is totally not the same thing. in JS, object literals is a object, so you can combine them with data and function, and you can call the method by dot, just like x.xxx(), and you can deconstruction it with the same symbol {...}, just like other object.</p> <p>but in python, dict is not a object, you can not use dot, and if you want deconstruction, you must use ** for it, by the way, you can deconstruction turple by *</p> <p>summarize: their is nothing just like object literals in python...</p>"
62431352	Are JavaScript object literals the same thing as Python dictionaries?	javascript|python|dictionary|object-literal	2020-06-17 14:26:34.273000 UTC	<p>I’ve started using JavaScript recently and have noticed a resemblance between JavaScript object literals and python dictionaries. They are used in similar situations and have similar syntax. So are they basically the same thing but with different names?</p>	"<p>They have the same structures; <code>key: value</code>. The key could be an array, integer, object etc. Same goes for the value.</p>  <p>Python:</p>  <pre><code>my_python_dictionary = {'name': 'John', age: 5, 123: 'a string'} one_of_the_values_of_my_python_dictionary = my_python_dictionary['name'] </code></pre>  <p>JavaScript:</p>  <pre><code>let myJavaScriptObjectLiteral = {""name"": ""John"", age: 5, 123: ""a string""} let oneOfTheValuesOfMyJavaScriptObjectLiteral = myJavaScriptObjectLiteral[""name""] </code></pre>"
62436893	Transpile python request in Javascript fetch?	javascript|python|post|authorization|fetch	2020-06-17 19:26:35.493000 UTC	"<p>I was wondering how to write this python request in javascript:</p>  <pre><code>url = ""something.something"" data = {""name"":""description""} auth = (""user"",""11111"")  x = requests.post(url, json=data, auth=auth) </code></pre>  <p>I have this so far:</p>  <pre><code>fetch(`something.something`, {       method: 'POST',       header: {         'Content-Type': 'application/json',         'Authorization': 'user:11111',       },       body: {         ""name"": ""description""       } }) </code></pre>  <p>But I have an 403. My guess is that the authorization is formatted incorrectly. </p>"	"<pre><code>auth = (""user"",""11111"")  x = requests.post(url, json=data, auth=auth) </code></pre>  <p>This uses <code>HTTPBasicAuth</code> for authorization. </p>  <p><a href=""https://en.wikipedia.org/wiki/Basic_access_authentication"" rel=""nofollow noreferrer"">Basic HTTP Auth</a> requires the credentials to be passed in the <code>Authorization</code> header like this:</p>  <pre><code>Authorization: Basic &lt;base64(user:password)&gt; </code></pre>  <p>So the javascript example should look something like:</p>  <pre><code>fetch(`something.something`, {       method: 'POST',       header: {         'Content-Type': 'application/json',         'Authorization': 'Basic ' + btoa('user:11111'),       },       body: {         ""name"": ""description""       } }) </code></pre>"
62448747	"How to create simple ""CHAT APP"" using Flask-SocketIO, Python, Javascript?"	javascript|python|flask|socket.io	2020-06-18 11:16:36.007000 UTC	"<p>How can I edit these codes so that when I click the button, the input texts will be appended to the empty unordered lists and be able to broadcast to other ""users""?</p>  <h1>HTML code</h1>  <pre><code>    &lt;body&gt;        &lt;ul&gt;        &lt;/ul&gt;        &lt;input type=""text"" id=""myMessage""&gt;        &lt;button&gt;Send&lt;/button&gt;     &lt;/body&gt; </code></pre>  <h1>Javascript Template code</h1>  <pre><code>document.addEventListener('DOMContentLoaded', () =&gt; {      var socket = io.connect(location.protocol + '//' + document.domain + ':' + location.port);      socket.on('connect', () =&gt; {      });      socket.on('announce chat', data =&gt; {      }); });  </code></pre>  <h1>Python code</h1>  <pre><code>app = Flask(__name__) app.config[""SECRET_KEY""] = os.getenv(""SECRET_KEY"") socketio = SocketIO(app)  @app.route(""/"") def index():     return render_template(""index.html"")  @socketio.on(""submit chat"") def chat(data): </code></pre>"	"<p>Well you dont call your submit chat and you should format it like submit_chat not with white space in between.</p>  <p>On your socket.io script you dont have submit_chat called you do have announce chat...</p>  <pre><code> socket.on('submit_chat', data =&gt; {  }); </code></pre>"
62463210	Communicating image data between Python and JavaScript	javascript|python|database	2020-06-19 04:21:39.690000 UTC	"<p>I'm currently working to send image data, in the form the byte arrays, from Python to JavaScript. I tried to use Redis as a means of in-memory, persistent communication channel, but it seems like bad design to force users to separately run <code>redis-cli</code> in the terminal. I tried to see if I can launch a Redis server using Python, but I could not find anything for that either. Is there an efficient, user-friendly way of setting up this type of communication? Would socket programming be a good way of setting up this communication channel as well?</p>"	"<p>To answer my own question, I decided to go down the path of using websockets to achieve bidirectional communication between Python and JavaScript. Specifically, I set up a websocket using <a href=""https://github.com/tornadoweb/tornado"" rel=""nofollow noreferrer"">tornado</a>, setup Python and JavaScript cilents, and communicate via event-driven programming.</p> <p>I really wanted to steer away from calling <code>redis-cli</code> or any other bash commands via subprocess, and I think using websockets is an elegant and efficient solution.</p>"
62463210	Communicating image data between Python and JavaScript	javascript|python|database	2020-06-19 04:21:39.690000 UTC	"<p>I'm currently working to send image data, in the form the byte arrays, from Python to JavaScript. I tried to use Redis as a means of in-memory, persistent communication channel, but it seems like bad design to force users to separately run <code>redis-cli</code> in the terminal. I tried to see if I can launch a Redis server using Python, but I could not find anything for that either. Is there an efficient, user-friendly way of setting up this type of communication? Would socket programming be a good way of setting up this communication channel as well?</p>"	"<p>You can start redis-cli from your python code using <a href=""https://docs.python.org/3/library/subprocess.html"" rel=""nofollow noreferrer"">subprocess</a>. As per my understanding of your problem, you have to use subprocess.Popen(), to run a terminal command in a separate thread(in parallel). If want your python code to wait for the terminal command to finish, you can use subprocess.call()</p>"
62472323	Is javascript date object compatible to python datetime object	javascript|python|django	2020-06-19 14:22:51.510000 UTC	"<p>For example in python, a date can be something like: 2020-06-19T11:32:16.548109Z, is there a way that i can use to convert this to a javascript Date object?</p>"	"<p>If your date from python is serialized into an <a href=""https://www.iso.org/iso-8601-date-and-time-format.html"" rel=""nofollow noreferrer"">ISO 8601</a> date format, then you can simply pass the string into the <code>Date</code> constructor in JavaScript. The precision of the decimal fraction is non-standard, as it is up the the language to decide that.</p>  <pre class=""lang-js prettyprint-override""><code>// 2020-06-19T11:32:16.548Z new Date('2020-06-19T11:32:16.548109Z').toISOString() </code></pre>  <pre class=""lang-js prettyprint-override""><code>// Fri, 19 Jun 2020 11:32:16 GMT new Date('2020-06-19T11:32:16.548109Z').toUTCString() </code></pre>  <hr>  <p><strong>Note:</strong> In Python, the precision of timestamp epochs are to the nearest microsecond. JavaScript will just ignore those when deserializing, because it uses millisecond epochs.</p>  <p>From <a href=""https://en.wikipedia.org/wiki/ISO_8601#General_principles"" rel=""nofollow noreferrer"">Wikipedia</a>:</p>  <blockquote>   <p><em>If necessary for a particular application, the standard supports the addition of a decimal fraction to the smallest time value in the representation.</em></p> </blockquote>  <p>Check this article out, as it explains how different languages handle ISO 8601:</p>  <blockquote>   <p><strong><em><a href=""https://nbsoftsolutions.com/blog/iso-8601-and-nanosecond-precision-across-languages"" rel=""nofollow noreferrer"">ISO 8601 and Nanosecond Precision Across Languages</a></em></strong></p> </blockquote>"
62476447	Python list of dicts not converting properly in javascript GET handler	javascript|python|django|ajax	2020-06-19 18:27:52.740000 UTC	"<p>i am sending data from views.py in Javascript Ajax function, but it was not converting string to dict  here is my  code  //////////////////////////////////// views.py</p>  <pre><code>def SortShop(request,shortby):     items = Item.objects.order_by(shortby)     item_list = []     for item in items:       item_list.append({'name':item.item_name,'title':item.item_titile,                           'pricse':item.item_FrashPricse,'dicsount':item.item_Discount_pricse,                           'image':item.item_image})  return HttpResponse([item_list]) </code></pre>  <p>///////////////////////////////////////////ajax function</p>  <pre><code>$('#sorting').on('change', function(e) {         selected_value = this.value         $.ajax({             type: 'GET',             url: '/shopsorting/' + selected_value,             // data: formData,             encode: true,             success: function(data) {                 y = JSON.stringify(data)                 x = JSON.parse(y)                 console.log(x)              }          });     });     }); </code></pre>  <p>////////////////////////////Result's is </p>  <pre><code>[{'name': 'Shoulder Bag',   'title': 'Boys Shoulder Bag (Yellow )',   'pricse': 15.99,   'dicsount': 0.0,   'image': &lt;ImageFieldFile: man-1.jpg&gt;},  {'name': 'Sweeter',   'title': 'Cotton Sweeter',   'pricse': 19.9,   'dicsount': 0.0,   'image': &lt;ImageFieldFile: product-6.jpg&gt;},  {'name': 'Shirt',   'title': 'Full Sleeves Shirt',   'pricse': 20.99,   'dicsount': 12.99,   'image': &lt;ImageFieldFile: man-4.jpg&gt;},  {'name': 'Jacket',   'title': 'Jackson Jacket',   'pricse': 20.25,   'dicsount': 0.0,   'image': &lt;ImageFieldFile: man-3.jpg&gt;},  {'name': 'Yellow Shoes',   'title': 'Leopard Shoes',   'pricse': 29.99,   'dicsount': 25.99,   'image': &lt;ImageFieldFile: man-2.jpg&gt;},  {'name': 'Bag',   'title': 'Mini Cary Bag',   'pricse': 14.99, 'dicsount': 12.99,   'image': &lt;ImageFieldFile: women-4.jpg&gt;},  {'name': 'Coat',   'title': 'Overcoat (Gray)',   'pricse': 17.7,   'dicsount': 0.0,   'image': &lt;ImageFieldFile: product-3.jpg&gt;},  {'name': 'TOWEL',   'title': 'Pure Pineapple',   'pricse': 19.9,   'dicsount': 0.0,   'image': &lt;ImageFieldFile: women-2.jpg&gt;},  {'name': 'Coat',   'title': 'Pure Pineapple',   'pricse': 17.9,   'dicsount': 11.9,   'image': &lt;ImageFieldFile: product-1.jpg&gt;},  {'name': 'TOWEL',   'title': 'Pure Pineapple (White)',   'pricse': 17.9, 'dicsount': 0.0,   'image': &lt;ImageFieldFile: product-2.jpg&gt;}] </code></pre>"	
62480499	"Need to get links from youtube video page, links are loading through javascript. Using python request module"	python|web-scraping|scrapy	2020-06-20 01:05:33.470000 UTC	<p>I need to read links of videos from below links.</p>  <pre><code>https://www.youtube.com/channel/UCoq5eKuZhG7Dm-63YFUYQog/videos </code></pre>  <p>The links which are loading at the start are easy to get but those are loading after javascript are difficult. Can anyone help me to identify how to get those using Python request module. I do not understand what would be the Post request.</p>	"<p>You can't use request smodule only. You would have to scrape website for those links with Selenium and / or BeautifulSoup. There is plenty of help here about those . </p>  <p>Here is a link to one of my answers which will give you a head start. </p>  <p><a href=""https://stackoverflow.com/a/62480188/13775029"">https://stackoverflow.com/a/62480188/13775029</a></p>  <p>You'll have to search for different div and possibly  tags .</p>"
62480499	"Need to get links from youtube video page, links are loading through javascript. Using python request module"	python|web-scraping|scrapy	2020-06-20 01:05:33.470000 UTC	<p>I need to read links of videos from below links.</p>  <pre><code>https://www.youtube.com/channel/UCoq5eKuZhG7Dm-63YFUYQog/videos </code></pre>  <p>The links which are loading at the start are easy to get but those are loading after javascript are difficult. Can anyone help me to identify how to get those using Python request module. I do not understand what would be the Post request.</p>	"<p>You can use the official API which is straightforward to search for the videos for a specific channel :</p>  <ul> <li>Go to <a href=""https://console.developers.google.com/"" rel=""nofollow noreferrer"">Google Developer Console</a>, search Youtube Data API / enable Youtube Data API v3</li> </ul>  <p><a href=""https://i.stack.imgur.com/nMieAm.png"" rel=""nofollow noreferrer""><img src=""https://i.stack.imgur.com/nMieAm.png"" alt=""enable API screen""></a></p>  <ul> <li>Go to Credentials / Create Credentials / API key</li> </ul>  <p><a href=""https://i.stack.imgur.com/fTQw9.png"" rel=""nofollow noreferrer""><img src=""https://i.stack.imgur.com/fTQw9.png"" alt=""API key screen""></a></p>  <ul> <li><p>install google api client for python :</p>  <pre><code>pip3 install --upgrade google-api-python-client </code></pre></li> </ul>  <p>Use the API key in the script below. This script fetch videos items from channel with id <code>UCoq5eKuZhG7Dm-63YFUYQog</code>, use <a href=""https://github.com/googleapis/google-api-python-client/blob/master/docs/pagination.md#pagination"" rel=""nofollow noreferrer"">pagination</a> to get all of them, and re-create the link from the videoId :</p>  <pre><code>import googleapiclient.discovery from urllib.parse import parse_qs, urlparse import re  #extract channel id from url url = 'https://www.youtube.com/channel/UCoq5eKuZhG7Dm-63YFUYQog/videos' channel_id = re.search('channel\/(.*)\/videos', url).group(1)  print(f'get all videos links from {channel_id}') youtube = googleapiclient.discovery.build(""youtube"", ""v3"", developerKey = ""YOUR_KEY"")  request = youtube.search().list(     channelId = channel_id,     part = ""id"",     maxResults = 50,     type = ""video"" ) response = request.execute()  videos_items = [] while request is not None:     response = request.execute()     videos_items += response[""items""]     request = youtube.search().list_next(request, response)  print(f""total: {len(videos_items)}"") print([      f'https://www.youtube.com/watch?v={t[""id""][""videoId""]}'     for t in videos_items ]) </code></pre>  <p>Output:</p>  <pre><code>get all videos links from UCoq5eKuZhG7Dm-63YFUYQog total: 80 [     'https://www.youtube.com/watch?v=uORsR14S7gw',      'https://www.youtube.com/watch?v=cARHPeZIUs4',      ............     'https://www.youtube.com/watch?v=CF2JO5a2EHE',      'https://www.youtube.com/watch?v=1yLesOxlHs0' ] </code></pre>  <p>If you need more details about the video, use <code>part = ""snippet""</code>, see <a href=""https://developers.google.com/youtube/v3/docs/search/list"" rel=""nofollow noreferrer"">this</a></p>"
62501059	"the javascript of pywebview python library for MacOS is working with a local implementation, but not from a remote web server"	python|macos|macos-catalina|pywebview	2020-06-21 15:59:03.547000 UTC	"<p>I'm quite a noob at any development at all.  So I apologize ahead of time if I'm missing something very trivial.</p> <p>I implemented pywebview on ubuntu and on raspbian, and now I'm trying to do it on MacOS.  the test bed is Catalina 10.15.5.</p> <p>the code I'm running:</p> <pre><code>import os import webview     def get_ip(self):             raw_ip = os.popen('curl https://ipinfo.io/ip').read()             local_ip = raw_ip.replace('\n','')             response = {&quot;ip&quot;: local_ip}             return response window = webview.create_window('PyWebView Test', 'https://website.com/index.html', js_api=api, width=1024, height=768) </code></pre> <p>on this html page, I try to display the public IP of my local machine:</p> <p>so in the html I run is:</p> <pre><code>&lt;html&gt; &lt;body&gt; &lt;h2 class=&quot;text&quot;&gt;Current IP:&lt;/h2&gt; &lt;h2 class=&quot;text&quot; id=&quot;local_ip&quot;&gt;&lt;/h2&gt; &lt;/body&gt; &lt;script&gt;     $(function getipaddress(){     $(document).ready(function () {       pywebview.api.get_ip().then(function(response) {         window.local_ip = response.ip;         $('#local_ip').html(window.local_ip);       })      });     }); &lt;/script&gt; &lt;/html&gt; </code></pre> <p>when I run this code locally, that is</p> <pre><code>window = webview.create_window('PyWebView Test', './index.html', js_api=api, width=1024, height=768) </code></pre> <p>when index.html is in the same folder, I'm able to see the IP address displayed, which is what is desired.</p> <p>I scoured for a solution, I've found <a href=""https://stackoverflow.com/questions/2101611/javascript-alert-not-working-in-embedded-webview"">this</a> which seems close, but I don't know how to implement this fix.  but unable to find what I need, please help!</p>"	"<p>within the JS on the html side, added an on mouse movement function and worked, which was acceptable for my use case.</p>"
