10233401	javascript Date and python datetime object	javascript|python|datetime	2012-04-19 17:23:18.080000 UTC	"<p>In javascript console ,I tried this</p>  <pre><code>d=new Date() t=d.getTime() </code></pre>  <p>When I printed t,it gave</p>  <pre><code>&gt;&gt;1334855220112 </code></pre>  <p>As per documentation ,it must be <code>the number of milliseconds since 1970/01/01</code></p>  <p>In python ,I created a <code>datetime.datetime</code> object as</p>  <pre><code>nowdtime=datetime.datetime.today() print str(int(nowdtime.strftime(""%s""))*1000) </code></pre>  <p>This gave the result:</p>  <pre><code>'1334855221000' </code></pre>  <p>This value looks very close to the result I got from javascript console.</p>  <p>the value of nowdtime is </p>  <pre><code>datetime.datetime(2012, 4, 19, 22, 37, 1, 866262) </code></pre>  <p>My doubt is why <code>nowdtime.strftime(""%s"")</code> returns number of seconds since epoch?  </p>  <p>If I give  <code>nowdtime.strftime(""%H"")</code> ,it will only return <code>22</code> which is the hour according to 24 hr clock.</p>"	10233735	"<p>The <code>%s</code> must be some sort of platform specific (ie, not documented at <a href=""http://docs.python.org/library/time.html#time.strftime"" rel=""nofollow"">http://docs.python.org/library/time.html#time.strftime</a>) directive:</p>  <blockquote>   <p>Additional directives may be supported on certain platforms, but only   the ones listed here have a meaning standardized by ANSI C.</p> </blockquote>  <p>Ie, Win7 Python 2.6.6 iPython console:</p>  <pre><code>import datetime d = datetime.datetime(2012, 4, 19, 22, 37, 1, 866262) d.strftime(""%s"") # gives: '' </code></pre>  <p>I'm not sure if this answers your question, because I'm not sure what your question is.</p>"
10233401	javascript Date and python datetime object	javascript|python|datetime	2012-04-19 17:23:18.080000 UTC	"<p>In javascript console ,I tried this</p>  <pre><code>d=new Date() t=d.getTime() </code></pre>  <p>When I printed t,it gave</p>  <pre><code>&gt;&gt;1334855220112 </code></pre>  <p>As per documentation ,it must be <code>the number of milliseconds since 1970/01/01</code></p>  <p>In python ,I created a <code>datetime.datetime</code> object as</p>  <pre><code>nowdtime=datetime.datetime.today() print str(int(nowdtime.strftime(""%s""))*1000) </code></pre>  <p>This gave the result:</p>  <pre><code>'1334855221000' </code></pre>  <p>This value looks very close to the result I got from javascript console.</p>  <p>the value of nowdtime is </p>  <pre><code>datetime.datetime(2012, 4, 19, 22, 37, 1, 866262) </code></pre>  <p>My doubt is why <code>nowdtime.strftime(""%s"")</code> returns number of seconds since epoch?  </p>  <p>If I give  <code>nowdtime.strftime(""%H"")</code> ,it will only return <code>22</code> which is the hour according to 24 hr clock.</p>"	18528712	<p>You can also just use the time method from time module <code>time.time()</code> to get a float that indicates the time in seconds since epoch.</p>
10235354	Convert a HTML/CSS/Javascript file to PDF using Python?	javascript|python|html|css|pdf	2012-04-19 19:27:24.247000 UTC	"<p>I need to convert a HTML+CSS+Javascript file to PDF from a Django View and therefor using Python.</p>  <p>I could use xhtml2pdf/PISA but it only supports HTML &amp; CSS, not Javascript, which is required.</p>  <p>Another option would be py-wkhtmltox, but it's getting pretty old and I haven't been able to get it to work yet, I just get ""ImportError: libwkhtmltox.so.0: cannot open shared object file: No such file or directory"", not sure where to get that file other then just to out of the blue rename libwkhtmltox.so to libwkhtmltox.so.0, but then I just get:</p>  <pre><code>Traceback (most recent call last):   File ""pdf_test1.py"", line 5, in &lt;module&gt;     pdf.set_object_setting('path', 'http://www.google.com')   File ""wkhtmltox.pyx"", line 118, in wkhtmltox.Pdf.__getattr__ (wkhtmltox.c:1228) AttributeError: 'wkhtmltox._Pdf' object has no attribute 'set_object_setting' </code></pre>  <p>Yet another option would be to use webkit ( <a href=""http://bharatikunal.wordpress.com/2010/01/31/converting-html-to-pdf-with-python-and-qt/"" rel=""nofollow"">http://bharatikunal.wordpress.com/2010/01/31/converting-html-to-pdf-with-python-and-qt/</a> ) but I can't execute ""sys.exit(app.exec_())"" from a Django view.</p>  <p>The only thing I can think of right now is to create a seperate webkit python script and os.system it from the django view, making ""sys.exit(app.exec_())"" possible and therefor the resultin PDF. But I'm open to other suggestions, seams a bit strange to use os.system from a django view.</p>  <p>Any ideas?</p>"	10236207	"<p>I suggest using <a href=""https://code.google.com/p/wkhtmltopdf/"" rel=""nofollow"">wkhtmltopdf</a>. It's available as a static binary for linux, so you shouldn't run into any shared object problems. wkhtmltopdf wraps webkit and supports javascript, and you can even tell it for how long to run any JS code before the rendering takes place. I've used it successfully to make PDFs of pages that had some complicated chart generating code on them. Just launch it using <code>subprocess.call()</code>.</p>"
10240190	Javascript library for displaying Python console app output	python|console|comet|javascript	2012-04-20 04:14:38.907000 UTC	"<p>I'm writing a <strong>simple web-based front-end</strong> for a Python <strong>console program</strong> that runs on a local machine. The interactions are extremely simple. Essentially, the web front-end needs to:</p>  <ol> <li>Accept input from the user (through an AJAX form or something).</li> <li>Pass this input to the Python program and run it.</li> <li>Display the output of the Python console program <em>while it is running</em>, until it terminates. </li> </ol>  <p>The first two can be accomplished quite easily (though suitable AJAX library recommendations would be helpful). </p>  <p><strong>Question</strong>: What Javascript library would I need to accomplish No. 3? </p>  <hr>  <p><strong>Remarks</strong>: </p>  <ul> <li>I am aware of packages like <code>AJAXterm</code> and <code>Shellinabox</code>, but instead of a full-shell, I just want to <em>display</em> the output of the Python console program; essentially I'd like a way to pipe Python's stdout to a web-page in real-time. </li> </ul>"	10242074	"<p>You are probably looking for a <a href=""http://en.wikipedia.org/wiki/Comet_%28programming%29"" rel=""nofollow"">comet</a> implementation or another server push protocol, because of the unpredictable timing of python code output. So on the server side you have a thread that is reading from your python process' <code>stdout</code> and pushing out the output to your client via comet. </p>  <p><a href=""http://cometd.org/"" rel=""nofollow"">cometd</a> may be your best bet for the client &amp; server components.</p>"
10264384	retrieving javascript cookies in google app engine (python)	python|google-app-engine	2012-04-22 01:02:24.003000 UTC	"<p>Does anyone know how to retrieve javascript cookies in gae python? I've seen complicated examples around the web, like cookiejar, but I think that module is too much for my simple site. I'm just trying to make a shopping cart that will take js cookies, send it to server-side code (python) for verification, and then post the data to google checkout.</p>  <p>Thanks :)</p>"	10264604	"<p>Hope this code would help with your problem, <a href=""https://developers.google.com/appengine/docs/python/tools/webapp/requestclass"" rel=""nofollow"">w/ helpful link</a>:</p>  <pre><code>from google.appengine.ext import webapp  class MyRequestHandler(webapp.RequestHandler):     def get(self):         self.response.out.write(self.request.cookies.get('cookiename')) </code></pre>  <p>If you are little bit confused JS cookies and the HTTP cookies are just the same. See <a href=""http://www.nczonline.net/blog/2009/05/05/http-cookies-explained/"" rel=""nofollow"">this article</a> for more clear explanation. Cookies are always transferred between <code>server</code> and <code>client</code> within the <code>HTTP header</code>. In this code we are just using the '<code>Set-cookie</code>' header within the request from client in server. <code>request.cookies</code> is a Python <code>dict</code> with cookies inside.</p>"
10286224	JavaScript timestamp to Python datetime conversion	javascript|python|timestamp	2012-04-23 18:33:48.123000 UTC	"<p>To get timestamp in JavaScript we use </p>  <pre><code>var ts = new Date().getTime() </code></pre>  <p>What is the proper way to convert it to a Python <code>datetime</code> so far I use the following code</p>  <pre><code>&gt;&gt;&gt; jsts = 1335205804950 &gt;&gt;&gt; dt = datetime.datetime.fromtimestamp(jsts/1000) &gt;&gt;&gt; dt datetime.datetime(2012, 4, 24, 0, 30, 4) </code></pre>  <p>I divide timestamp by 1000 because I get error like </p>  <pre><code>ValueError                                Traceback (most recent call last) 1 d = datetime.datetime.fromtimestamp(a) ValueError: year is out of range </code></pre>  <p>Sultan.</p>"	10286261	"<p>Your current method is correct, dividing by 1000 is necessary because your JavaScript returns the timestamp in milliseconds, and <code>datetime.datetime.fromtimestamp()</code> expects a timestamp in seconds.</p>  <p>To preserve the millisecond accuracy you can divide by <code>1000.0</code>, so you are using float division instead of integer division:</p>  <pre><code>&gt;&gt;&gt; dt = datetime.datetime.fromtimestamp(jsts/1000.0) &gt;&gt;&gt; dt datetime.datetime(2012, 4, 23, 11, 30, 4, 950000) </code></pre>"
10286224	JavaScript timestamp to Python datetime conversion	javascript|python|timestamp	2012-04-23 18:33:48.123000 UTC	"<p>To get timestamp in JavaScript we use </p>  <pre><code>var ts = new Date().getTime() </code></pre>  <p>What is the proper way to convert it to a Python <code>datetime</code> so far I use the following code</p>  <pre><code>&gt;&gt;&gt; jsts = 1335205804950 &gt;&gt;&gt; dt = datetime.datetime.fromtimestamp(jsts/1000) &gt;&gt;&gt; dt datetime.datetime(2012, 4, 24, 0, 30, 4) </code></pre>  <p>I divide timestamp by 1000 because I get error like </p>  <pre><code>ValueError                                Traceback (most recent call last) 1 d = datetime.datetime.fromtimestamp(a) ValueError: year is out of range </code></pre>  <p>Sultan.</p>"	10286275	"<p>The way you do it is the correct way, because js includes milliseconds in the date/time. Python (and PHP) as far as I know, don't. For more precision you could use <code>/1000.0</code>.</p>"
10286224	JavaScript timestamp to Python datetime conversion	javascript|python|timestamp	2012-04-23 18:33:48.123000 UTC	"<p>To get timestamp in JavaScript we use </p>  <pre><code>var ts = new Date().getTime() </code></pre>  <p>What is the proper way to convert it to a Python <code>datetime</code> so far I use the following code</p>  <pre><code>&gt;&gt;&gt; jsts = 1335205804950 &gt;&gt;&gt; dt = datetime.datetime.fromtimestamp(jsts/1000) &gt;&gt;&gt; dt datetime.datetime(2012, 4, 24, 0, 30, 4) </code></pre>  <p>I divide timestamp by 1000 because I get error like </p>  <pre><code>ValueError                                Traceback (most recent call last) 1 d = datetime.datetime.fromtimestamp(a) ValueError: year is out of range </code></pre>  <p>Sultan.</p>"	46687300	"<p>For others still getting an error: I had a similar issue but the unix timestamp was in microseconds, i.e. I had to divide the timestamp by 1000000 to get the correct result.</p>  <pre><code>dt = datetime.datetime.fromtimestamp(1502360499615921) </code></pre>"
10286224	JavaScript timestamp to Python datetime conversion	javascript|python|timestamp	2012-04-23 18:33:48.123000 UTC	"<p>To get timestamp in JavaScript we use </p>  <pre><code>var ts = new Date().getTime() </code></pre>  <p>What is the proper way to convert it to a Python <code>datetime</code> so far I use the following code</p>  <pre><code>&gt;&gt;&gt; jsts = 1335205804950 &gt;&gt;&gt; dt = datetime.datetime.fromtimestamp(jsts/1000) &gt;&gt;&gt; dt datetime.datetime(2012, 4, 24, 0, 30, 4) </code></pre>  <p>I divide timestamp by 1000 because I get error like </p>  <pre><code>ValueError                                Traceback (most recent call last) 1 d = datetime.datetime.fromtimestamp(a) ValueError: year is out of range </code></pre>  <p>Sultan.</p>"	66113698	"<p>I've had the same issue, thanks to @andrew-clark for the answer, i've build a small example to handle both cases:</p> <pre><code>     try:         # when timestamp is in seconds         date = datetime.fromtimestamp(timestamp)     except (ValueError):         # when timestamp is in miliseconds         date = datetime.fromtimestamp(timestamp / 1000) </code></pre>"
10290074	can httplib (python) interact with a page and its javascript?	javascript|python|web|httplib	2012-04-24 00:12:22.183000 UTC	"<p>I want to write a python script that will ask for reddit post url, go to the page, login with a specified account and upvote the post and the logout. </p>  <p>A) can this be done with python? </p>  <p>B) How would I do this? If you can provide code that would be great, but don't kill yourself.  </p>"	10290103	"<p>Do you really need to interact with JavaScript?</p>  <p>You can reverse engineer Reddit code by looking at AJAX requests made using Firebug or any other debugger, checking cookies, request parameters, etc. </p>  <p>After this you can simulate this requests using Python's urllib by setting same request type (GET vs POST), request parameters and cookies.</p>  <p>Also check this post <a href=""https://stackoverflow.com/questions/2081586/web-scraping-with-python"">web-scraping-with-python</a></p>"
10290074	can httplib (python) interact with a page and its javascript?	javascript|python|web|httplib	2012-04-24 00:12:22.183000 UTC	"<p>I want to write a python script that will ask for reddit post url, go to the page, login with a specified account and upvote the post and the logout. </p>  <p>A) can this be done with python? </p>  <p>B) How would I do this? If you can provide code that would be great, but don't kill yourself.  </p>"	10290150	"<p>Besides @Maksym's great suggestion above, you could also use a browser testing tool like <a href=""http://seleniumhq.org/"" rel=""nofollow"">Selenium</a> (which has python bindings) to write a script to interact with the Reddit page directly.  The downside is that it would open a copy of your browser every time it runs, and I'm not sure if that would be an issue for you.</p>"
10291772	to submit request in python mechanize for javascript	javascript|python|mechanize	2012-04-24 04:32:49.923000 UTC	"<p>I am working with the page<br> <a href=""http://index.cepd.gov.tw/inQuery.aspx?lang=2&amp;type=it02"" rel=""nofollow"">http://index.cepd.gov.tw/inQuery.aspx?lang=2&amp;type=it02</a></p>  <p>in this page, I am submitting values using python mechanize.<br> but, when I submit it, it gives me the same url.<br> I want the url of the next page after submit.  </p>  <p>Is it due to javascript?<br> Is any way to work with javascript to get next url? </p>"	10295453	"<p>If after submission you are getting the same page, I assume the javascript is setting some hidden field after validation.</p>  <p>Try stopping javascript execution in your browser and submitting the form (from the browser). If it doesn't work, then mechanize won't be enough (since it doesn't support javascript execution) and you will need some browser automation tool.</p>"
10299774	Downloading a file from Javascript onclick function in python	javascript|python|html	2012-04-24 14:14:26.913000 UTC	"<p>Suppose i had an anchor tag named ""Click to download"" on a page which downloads a csv file when clicked </p>  <p>The HTML Code is</p>  <pre><code>&lt;span id=""tag_id""&gt;     &lt;a class=""classA"" onclick=""calling_an_excel_function()"" href=""#""&gt; Click here to download all records.&lt;/a&gt; &lt;/span&gt;  </code></pre>  <p>Actually it is calling an Javascript Onclick function and generating a csv file and the code of onclick function is</p>  <pre><code>function calling_an_excel_function() {     var exampleA = document.getElementById('exampleA.value');     var exampleB = document.getElementById('exampleB.value');     var exampleC = document.getElementById('exampleC.value');     var exampleD = document.getElementById('exampleD.value');     window.open('indices_main_excel.aspx?ind=' + exampleA.value + '&amp;fromDate=' + exampleB.value + '&amp;toDate=' + examplec.value + '&amp;DMY=' + exampleD.value, '_blank', 'toolbar=yes,location=no, directories=no, status=no, menubar=yes,scrollbars=yes, resizable=yes ,copyhistory=no, width=800, height=600'); }  </code></pre>  <p>I can expect that in onclick function <strong>window.open()</strong> method is generating a new file with some values given. Now i am unable to get <strong>csv</strong> file downloading <strong>url</strong> from the above onclick function  Can i know how to get the csv file downloading link </p>"	10299835	<p>(Just guessing)</p>  <p>But you probably want</p>  <pre><code>document.getElementById('exampleA'); </code></pre>  <p>instead of</p>  <pre><code>document.getElementById('exampleA.value'); </code></pre>
10299774	Downloading a file from Javascript onclick function in python	javascript|python|html	2012-04-24 14:14:26.913000 UTC	"<p>Suppose i had an anchor tag named ""Click to download"" on a page which downloads a csv file when clicked </p>  <p>The HTML Code is</p>  <pre><code>&lt;span id=""tag_id""&gt;     &lt;a class=""classA"" onclick=""calling_an_excel_function()"" href=""#""&gt; Click here to download all records.&lt;/a&gt; &lt;/span&gt;  </code></pre>  <p>Actually it is calling an Javascript Onclick function and generating a csv file and the code of onclick function is</p>  <pre><code>function calling_an_excel_function() {     var exampleA = document.getElementById('exampleA.value');     var exampleB = document.getElementById('exampleB.value');     var exampleC = document.getElementById('exampleC.value');     var exampleD = document.getElementById('exampleD.value');     window.open('indices_main_excel.aspx?ind=' + exampleA.value + '&amp;fromDate=' + exampleB.value + '&amp;toDate=' + examplec.value + '&amp;DMY=' + exampleD.value, '_blank', 'toolbar=yes,location=no, directories=no, status=no, menubar=yes,scrollbars=yes, resizable=yes ,copyhistory=no, width=800, height=600'); }  </code></pre>  <p>I can expect that in onclick function <strong>window.open()</strong> method is generating a new file with some values given. Now i am unable to get <strong>csv</strong> file downloading <strong>url</strong> from the above onclick function  Can i know how to get the csv file downloading link </p>"	10299878	"<p>You don't need to use Window.open. Change the href to equal the file path (yes, it's coming from you server code) or use window.location. Make sure you set the content-disposition header.</p>  <p>I don't know how to set headers in python, but you'll want to set a header that looks like this:</p>  <p>Content-Disposition: attachment; filename=""filename.csv""</p>"
10358499	how to use python with javascript?	javascript|python|django-models	2012-04-27 22:08:22.163000 UTC	"<p>I have an object ""company"". When I use company inside of html, it works fine. But when I tried to use that object inside javascript I get the ""Uncaught SyntaxError: Unexpected token &amp;"".</p>  <p>What I am trying to do is getting the objects from db then display them on html page then change up some divs using js.</p>  <p>the url:</p>  <pre><code>('^all_companies$', 'companies.views.all_companies') </code></pre>  <p>the view:</p>  <pre><code>def all_companies(request):      companies = Company.objects.all().order_by('id')[:5];        return direct_to_template(request, 'all_companies.html', {'companies': companies} ); </code></pre>  <p>the html:</p>  <pre><code>{% block sidebar %}     &lt;div id=""sidebar""&gt;         &lt;!-- like google maps, short list of company info --&gt;         &lt;ul&gt;             {% for comp in companies %}                 &lt;li&gt;{{ comp }}&lt;/li&gt;                              {% endfor %}         &lt;/ul&gt;     &lt;/div&gt; {% endblock %} </code></pre>  <p>the js:</p>  <pre><code>var tmp = {{ companies }} </code></pre>"	10358605	"<p>You can add a template filter like that one: <a href=""http://djangosnippets.org/snippets/201/"" rel=""nofollow"">http://djangosnippets.org/snippets/201/</a></p>  <p>and use </p>  <pre><code>{{ companies | jsonify }} </code></pre>  <p>but I'm not sure it's a good idea to do that directly on a db object, it will be better to map them to a simple map of properties you need</p>"
10360817	Is there any Python module that helps to crawl data from DOM loaded by Javascript?	python|web-crawler|web-scraping	2012-04-28 05:14:58.587000 UTC	"<p>I want to scrape data from a page which loads DOM elements using Ajax call.</p>  <p>I have tried with the old solution line PyQt4-based scraping, which loads the DOM after it's fully loaded, but the problem is that I need to do a POST request and it's only available for GET.</p>  <p>The new Python module <a href=""http://jeanphix.me/Ghost.py/"" rel=""nofollow"">ghost.py</a> has time out issues: when it fetches a large DOM tree it raises a time out exception.</p>  <p>If anyone knows any specific way or tools that can help me to do a POST request and grab the data after fully loaded DOM, that will help me a lot.</p>"	10360892	"<p>You can use <a href=""http://seleniumhq.org/"" rel=""nofollow"">Selenium</a> to automate browser and access dom. Selenium has python driver hence you can write code in python to navigate to the page. click buttons and wait for ajax call to complete before you start scrapping.</p>"
10360817	Is there any Python module that helps to crawl data from DOM loaded by Javascript?	python|web-crawler|web-scraping	2012-04-28 05:14:58.587000 UTC	"<p>I want to scrape data from a page which loads DOM elements using Ajax call.</p>  <p>I have tried with the old solution line PyQt4-based scraping, which loads the DOM after it's fully loaded, but the problem is that I need to do a POST request and it's only available for GET.</p>  <p>The new Python module <a href=""http://jeanphix.me/Ghost.py/"" rel=""nofollow"">ghost.py</a> has time out issues: when it fetches a large DOM tree it raises a time out exception.</p>  <p>If anyone knows any specific way or tools that can help me to do a POST request and grab the data after fully loaded DOM, that will help me a lot.</p>"	24184155	"<p>For emulating Javascript and automate browser, I recommend `<a href=""https://pypi.python.org/pypi/spynner"" rel=""nofollow""><strong>Spynner</strong></a>. You can run it with or without a Xserver and the syntax is quite simple to use. You can load jquery too.</p>"
10363902	Executing JavaScript in pure Python environment	javascript|python|google-app-engine	2012-04-28 13:24:15.763000 UTC	<p>I want to run existing simple (no special tricks) JavaScript code (several thousand lines) in a pure Python environment (Google AppEngine).</p>  <p>The code runs fine with PyV8 (but it is not pure Python).</p>  <p>Is PyJON mature enough for this?</p>  <p>Can I define custom objects in Python and use them in JavaScript (like in PyV8)?</p>	10390235	"<p>You can use <a href=""http://gae-init.appspot.com"" rel=""nofollow"">gae-init</a>, where you can access you datastore objects in JSON format.</p>"
10395319	python convert str to javascript literal string	javascript|python	2012-05-01 08:27:57.933000 UTC	"<p>I want to use python to generate javascript code dynamiclly. </p>  <pre><code>def convert(jsstring=''):     return 'function dosomething () { return %s.toLowerCase(); }' % jsstring </code></pre>  <p>The problem is <code>jsstring</code> is a python string.</p>  <p>How can i convert it back to javascript string literal to make <code>dosomething</code> a valid javascript function ?</p>  <p>for example</p>  <p>call</p>  <pre><code>convert(""javascript"") </code></pre>  <p>now output</p>  <pre><code> function dosomething () { return javascript.toLowerCase(); } </code></pre>  <p>which is not a valid javascript function</p>  <p>expected output</p>  <pre><code> function dosomething () { return ""javascript"".toLowerCase(); } </code></pre>  <p>another example, call</p>  <pre><code>convert(""javascript\'"") </code></pre>  <p>expected output</p>  <pre><code> function dosomething () { return ""javascript\'"".toLowerCase(); } </code></pre>  <p>Thanks a lot.</p>"	10395415	"<p>How about adding appropriate quotes around <code>%s</code>, i.e.:</p>  <pre><code>'function dosomething () { return ""%s"".toLowerCase(); }' % jsstring </code></pre>  <p>Here's a command-line session to clarify the difference:</p>  <pre><code>In [10]: joe = 'somestring'  In [11]: '%s.toLowerCase();' % joe Out[11]: 'somestring.toLowerCase();'  In [12]: '""%s"".toLowerCase();' % joe Out[12]: '""somestring"".toLowerCase();' </code></pre>"
